ID,URL,Title,Difficulty,Acceptance %,Frequency %,Topics,Timeframe
17,https://leetcode.com/problems/letter-combinations-of-a-phone-number,Letter Combinations of a Phone Number,Medium,,45.9%,"Hash Table, String, Backtracking",all
69,https://leetcode.com/problems/sqrtx,Sqrt(x),Easy,,45.9%,"Math, Binary Search",all
208,https://leetcode.com/problems/implement-trie-prefix-tree,Implement Trie (Prefix Tree),Medium,,45.9%,"Hash Table, String, Design, Trie",all
346,https://leetcode.com/problems/moving-average-from-data-stream,Moving Average from Data Stream,Easy,,45.9%,"Array, Design, Queue, Data Stream",all
1203,https://leetcode.com/problems/sort-items-by-groups-respecting-dependencies,Sort Items by Groups Respecting Dependencies,Hard,,45.9%,"Depth-First Search, Breadth-First Search, Graph, Topological Sort",all
1670,https://leetcode.com/problems/design-front-middle-back-queue,Design Front Middle Back Queue,Medium,,45.9%,"Array, Linked List, Design, Queue, Data Stream",all
4,https://leetcode.com/problems/median-of-two-sorted-arrays,Median of Two Sorted Arrays,Hard,,45.9%,"Array, Binary Search, Divide and Conquer",all
1606,https://leetcode.com/problems/find-servers-that-handled-most-number-of-requests,Find Servers That Handled Most Number of Requests,Hard,,45.9%,"Array, Greedy, Heap (Priority Queue), Ordered Set",all
329,https://leetcode.com/problems/longest-increasing-path-in-a-matrix,Longest Increasing Path in a Matrix,Hard,,45.9%,"Array, Dynamic Programming, Depth-First Search, Breadth-First Search, Graph, Topological Sort, Memoization, Matrix",all
198,https://leetcode.com/problems/house-robber,House Robber,Medium,,45.9%,"Array, Dynamic Programming",all
221,https://leetcode.com/problems/maximal-square,Maximal Square,Medium,,45.9%,"Array, Dynamic Programming, Matrix",all
15,https://leetcode.com/problems/3sum,3Sum,Medium,,45.9%,"Array, Two Pointers, Sorting",all
279,https://leetcode.com/problems/perfect-squares,Perfect Squares,Medium,,45.9%,"Math, Dynamic Programming, Breadth-First Search",all
310,https://leetcode.com/problems/minimum-height-trees,Minimum Height Trees,Medium,,45.9%,"Depth-First Search, Breadth-First Search, Graph, Topological Sort",all
269,https://leetcode.com/problems/alien-dictionary,Alien Dictionary,Hard,,45.9%,"Array, String, Depth-First Search, Breadth-First Search, Graph, Topological Sort",all
2466,https://leetcode.com/problems/count-ways-to-build-good-strings,Count Ways To Build Good Strings,Medium,,45.9%,Dynamic Programming,all
782,https://leetcode.com/problems/transform-to-chessboard,Transform to Chessboard,Hard,,45.9%,"Array, Math, Bit Manipulation, Matrix",all
714,https://leetcode.com/problems/best-time-to-buy-and-sell-stock-with-transaction-fee,Best Time to Buy and Sell Stock with Transaction Fee,Medium,,37.1%,"Array, Dynamic Programming, Greedy",all
752,https://leetcode.com/problems/open-the-lock,Open the Lock,Medium,,37.1%,"Array, Hash Table, String, Breadth-First Search",all
875,https://leetcode.com/problems/koko-eating-bananas,Koko Eating Bananas,Medium,,37.1%,"Array, Binary Search",all
117,https://leetcode.com/problems/populating-next-right-pointers-in-each-node-ii,Populating Next Right Pointers in Each Node II,Medium,,37.1%,"Linked List, Tree, Depth-First Search, Breadth-First Search, Binary Tree",all
149,https://leetcode.com/problems/max-points-on-a-line,Max Points on a Line,Hard,,37.1%,"Array, Hash Table, Math, Geometry",all
12,https://leetcode.com/problems/integer-to-roman,Integer to Roman,Medium,,37.1%,"Hash Table, Math, String",all
47,https://leetcode.com/problems/permutations-ii,Permutations II,Medium,,37.1%,"Array, Backtracking, Sorting",all
50,https://leetcode.com/problems/powx-n,"Pow(x, n)",Medium,,37.1%,"Math, Recursion",all
71,https://leetcode.com/problems/simplify-path,Simplify Path,Medium,,37.1%,"String, Stack",all
11,https://leetcode.com/problems/container-with-most-water,Container With Most Water,Medium,,37.1%,"Array, Two Pointers, Greedy",all
994,https://leetcode.com/problems/rotting-oranges,Rotting Oranges,Medium,,37.1%,"Array, Breadth-First Search, Matrix",all
300,https://leetcode.com/problems/longest-increasing-subsequence,Longest Increasing Subsequence,Medium,,37.1%,"Array, Binary Search, Dynamic Programming",all
1632,https://leetcode.com/problems/rank-transform-of-a-matrix,Rank Transform of a Matrix,Hard,,37.1%,"Array, Union Find, Graph, Topological Sort, Sorting, Matrix",all
256,https://leetcode.com/problems/paint-house,Paint House,Medium,,37.1%,"Array, Dynamic Programming",all
974,https://leetcode.com/problems/subarray-sums-divisible-by-k,Subarray Sums Divisible by K,Medium,,37.1%,"Array, Hash Table, Prefix Sum",all
240,https://leetcode.com/problems/search-a-2d-matrix-ii,Search a 2D Matrix II,Medium,,37.1%,"Array, Binary Search, Divide and Conquer, Matrix",all
188,https://leetcode.com/problems/best-time-to-buy-and-sell-stock-iv,Best Time to Buy and Sell Stock IV,Hard,,37.1%,"Array, Dynamic Programming",all
381,https://leetcode.com/problems/insert-delete-getrandom-o1-duplicates-allowed,Insert Delete GetRandom O(1) - Duplicates allowed,Hard,,37.1%,"Array, Hash Table, Math, Design, Randomized",all
126,https://leetcode.com/problems/word-ladder-ii,Word Ladder II,Hard,,37.1%,"Hash Table, String, Backtracking, Breadth-First Search",all
815,https://leetcode.com/problems/bus-routes,Bus Routes,Hard,,37.1%,"Array, Hash Table, Breadth-First Search",all
207,https://leetcode.com/problems/course-schedule,Course Schedule,Medium,,37.1%,"Depth-First Search, Breadth-First Search, Graph, Topological Sort",all
767,https://leetcode.com/problems/reorganize-string,Reorganize String,Medium,,37.1%,"Hash Table, String, Greedy, Sorting, Heap (Priority Queue), Counting",all
1143,https://leetcode.com/problems/longest-common-subsequence,Longest Common Subsequence,Medium,,37.1%,"String, Dynamic Programming",all
1884,https://leetcode.com/problems/egg-drop-with-2-eggs-and-n-floors,Egg Drop With 2 Eggs and N Floors,Medium,,37.1%,"Math, Dynamic Programming",all
210,https://leetcode.com/problems/course-schedule-ii,Course Schedule II,Medium,,37.1%,"Depth-First Search, Breadth-First Search, Graph, Topological Sort",all
116,https://leetcode.com/problems/populating-next-right-pointers-in-each-node,Populating Next Right Pointers in Each Node,Medium,,37.1%,"Linked List, Tree, Depth-First Search, Breadth-First Search, Binary Tree",all
688,https://leetcode.com/problems/knight-probability-in-chessboard,Knight Probability in Chessboard,Medium,,37.1%,Dynamic Programming,all
735,https://leetcode.com/problems/asteroid-collision,Asteroid Collision,Medium,,37.1%,"Array, Stack, Simulation",all
218,https://leetcode.com/problems/the-skyline-problem,The Skyline Problem,Hard,,37.1%,"Array, Divide and Conquer, Binary Indexed Tree, Segment Tree, Line Sweep, Heap (Priority Queue), Ordered Set",all
224,https://leetcode.com/problems/basic-calculator,Basic Calculator,Hard,,37.1%,"Math, String, Stack, Recursion",all
2044,https://leetcode.com/problems/count-number-of-maximum-bitwise-or-subsets,Count Number of Maximum Bitwise-OR Subsets,Medium,,37.1%,"Array, Backtracking, Bit Manipulation, Enumeration",all
