ID,URL,Title,Difficulty,Acceptance %,Frequency %,Topics,Timeframe
349,https://leetcode.com/problems/intersection-of-two-arrays,Intersection of Two Arrays,Easy,,49.7%,"Array, Hash Table, Two Pointers, Binary Search, Sorting",more_than_6m
322,https://leetcode.com/problems/coin-change,Coin Change,Medium,,49.4%,"Array, Dynamic Programming, Breadth-First Search",more_than_6m
37,https://leetcode.com/problems/sudoku-solver,Sudoku Solver,Hard,,48.9%,"Array, Hash Table, Backtracking, Matrix",more_than_6m
46,https://leetcode.com/problems/permutations,Permutations,Medium,,48.9%,"Array, Backtracking",more_than_6m
234,https://leetcode.com/problems/palindrome-linked-list,Palindrome Linked List,Easy,,48.9%,"Linked List, Two Pointers, Stack, Recursion",more_than_6m
36,https://leetcode.com/problems/valid-sudoku,Valid Sudoku,Medium,,48.6%,"Array, Hash Table, Matrix",more_than_6m
135,https://leetcode.com/problems/candy,Candy,Hard,,48.6%,"Array, Greedy",more_than_6m
155,https://leetcode.com/problems/min-stack,Min Stack,Medium,,48.6%,"Stack, Design",more_than_6m
16,https://leetcode.com/problems/3sum-closest,3Sum Closest,Medium,,48.3%,"Array, Two Pointers, Sorting",more_than_6m
1101,https://leetcode.com/problems/the-earliest-moment-when-everyone-become-friends,The Earliest Moment When Everyone Become Friends,Medium,,48.3%,"Array, Union-Find, Sorting",more_than_6m
41,https://leetcode.com/problems/first-missing-positive,First Missing Positive,Hard,,48.0%,"Array, Hash Table",more_than_6m
122,https://leetcode.com/problems/best-time-to-buy-and-sell-stock-ii,Best Time to Buy and Sell Stock II,Medium,,48.0%,"Array, Dynamic Programming, Greedy",more_than_6m
3623,https://leetcode.com/problems/count-number-of-trapezoids-i,Count Number of Trapezoids I,Medium,,48.0%,"Array, Hash Table, Math, Geometry",more_than_6m
151,https://leetcode.com/problems/reverse-words-in-a-string,Reverse Words in a String,Medium,,47.7%,"Two Pointers, String",more_than_6m
1004,https://leetcode.com/problems/max-consecutive-ones-iii,Max Consecutive Ones III,Medium,,47.7%,"Array, Binary Search, Sliding Window, Prefix Sum",more_than_6m
175,https://leetcode.com/problems/combine-two-tables,Combine Two Tables,Easy,,47.7%,Database,more_than_6m
45,https://leetcode.com/problems/jump-game-ii,Jump Game II,Medium,,47.4%,"Array, Dynamic Programming, Greedy",more_than_6m
141,https://leetcode.com/problems/linked-list-cycle,Linked List Cycle,Easy,,47.4%,"Hash Table, Linked List, Two Pointers",more_than_6m
416,https://leetcode.com/problems/partition-equal-subset-sum,Partition Equal Subset Sum,Medium,,47.4%,"Array, Dynamic Programming",more_than_6m
3453,https://leetcode.com/problems/separate-squares-i,Separate Squares I,Medium,,47.4%,"Array, Binary Search",more_than_6m
876,https://leetcode.com/problems/middle-of-the-linked-list,Middle of the Linked List,Easy,,47.1%,"Linked List, Two Pointers",more_than_6m
68,https://leetcode.com/problems/text-justification,Text Justification,Hard,,46.8%,"Array, String, Simulation",more_than_6m
219,https://leetcode.com/problems/contains-duplicate-ii,Contains Duplicate II,Easy,,46.8%,"Array, Hash Table, Sliding Window",more_than_6m
2877,https://leetcode.com/problems/create-a-dataframe-from-list,Create a DataFrame from List,Easy,,46.8%,,more_than_6m
61,https://leetcode.com/problems/rotate-list,Rotate List,Medium,,46.4%,"Linked List, Two Pointers",more_than_6m
380,https://leetcode.com/problems/insert-delete-getrandom-o1,Insert Delete GetRandom O(1),Medium,,46.4%,"Array, Hash Table, Math, Design, Randomized",more_than_6m
1929,https://leetcode.com/problems/concatenation-of-array,Concatenation of Array,Easy,,46.4%,"Array, Simulation",more_than_6m
25,https://leetcode.com/problems/reverse-nodes-in-k-group,Reverse Nodes in k-Group,Hard,,46.4%,"Linked List, Recursion",more_than_6m
907,https://leetcode.com/problems/sum-of-subarray-minimums,Sum of Subarray Minimums,Medium,,46.1%,"Array, Dynamic Programming, Stack, Monotonic Stack",more_than_6m
39,https://leetcode.com/problems/combination-sum,Combination Sum,Medium,,45.8%,"Array, Backtracking",more_than_6m
167,https://leetcode.com/problems/two-sum-ii-input-array-is-sorted,Two Sum II - Input Array Is Sorted,Medium,,45.4%,"Array, Two Pointers, Binary Search",more_than_6m
852,https://leetcode.com/problems/peak-index-in-a-mountain-array,Peak Index in a Mountain Array,Medium,,45.4%,"Array, Binary Search",more_than_6m
131,https://leetcode.com/problems/palindrome-partitioning,Palindrome Partitioning,Medium,,45.4%,"String, Dynamic Programming, Backtracking",more_than_6m
204,https://leetcode.com/problems/count-primes,Count Primes,Medium,,45.4%,"Array, Math, Enumeration, Number Theory",more_than_6m
402,https://leetcode.com/problems/remove-k-digits,Remove K Digits,Medium,,45.4%,"String, Stack, Greedy, Monotonic Stack",more_than_6m
904,https://leetcode.com/problems/fruit-into-baskets,Fruit Into Baskets,Medium,,45.1%,"Array, Hash Table, Sliding Window",more_than_6m
72,https://leetcode.com/problems/edit-distance,Edit Distance,Medium,,45.1%,"String, Dynamic Programming",more_than_6m
843,https://leetcode.com/problems/guess-the-word,Guess the Word,Hard,,45.1%,"Array, Math, String, Interactive, Game Theory",more_than_6m
584,https://leetcode.com/problems/find-customer-referee,Find Customer Referee,Easy,,44.7%,Database,more_than_6m
939,https://leetcode.com/problems/minimum-area-rectangle,Minimum Area Rectangle,Medium,,44.7%,"Array, Hash Table, Math, Geometry, Sorting",more_than_6m
205,https://leetcode.com/problems/isomorphic-strings,Isomorphic Strings,Easy,,44.4%,"Hash Table, String",more_than_6m
79,https://leetcode.com/problems/word-search,Word Search,Medium,,44.4%,"Array, String, Backtracking, Depth-First Search, Matrix",more_than_6m
287,https://leetcode.com/problems/find-the-duplicate-number,Find the Duplicate Number,Medium,,44.4%,"Array, Two Pointers, Binary Search, Bit Manipulation",more_than_6m
715,https://leetcode.com/problems/range-module,Range Module,Hard,,44.4%,"Design, Segment Tree, Ordered Set",more_than_6m
509,https://leetcode.com/problems/fibonacci-number,Fibonacci Number,Easy,,44.4%,"Math, Dynamic Programming, Recursion, Memoization",more_than_6m
176,https://leetcode.com/problems/second-highest-salary,Second Highest Salary,Medium,,44.0%,Database,more_than_6m
443,https://leetcode.com/problems/string-compression,String Compression,Medium,,44.0%,"Two Pointers, String",more_than_6m
58,https://leetcode.com/problems/length-of-last-word,Length of Last Word,Easy,,44.0%,String,more_than_6m
100,https://leetcode.com/problems/same-tree,Same Tree,Easy,,44.0%,"Tree, Depth-First Search, Breadth-First Search, Binary Tree",more_than_6m
595,https://leetcode.com/problems/big-countries,Big Countries,Easy,,44.0%,Database,more_than_6m
912,https://leetcode.com/problems/sort-an-array,Sort an Array,Medium,,44.0%,"Array, Divide and Conquer, Sorting, Heap (Priority Queue), Merge Sort, Bucket Sort, Radix Sort, Counting Sort",more_than_6m
90,https://leetcode.com/problems/subsets-ii,Subsets II,Medium,,43.6%,"Array, Backtracking, Bit Manipulation",more_than_6m
1148,https://leetcode.com/problems/article-views-i,Article Views I,Easy,,43.6%,Database,more_than_6m
567,https://leetcode.com/problems/permutation-in-string,Permutation in String,Medium,,43.6%,"Hash Table, Two Pointers, String, Sliding Window",more_than_6m
1752,https://leetcode.com/problems/check-if-array-is-sorted-and-rotated,Check if Array Is Sorted and Rotated,Easy,,43.6%,Array,more_than_6m
3481,https://leetcode.com/problems/apply-substitutions,Apply Substitutions,Medium,,43.6%,"Array, Hash Table, String, Depth-First Search, Breadth-First Search, Graph Theory, Topological Sort",more_than_6m
12,https://leetcode.com/problems/integer-to-roman,Integer to Roman,Medium,,43.2%,"Hash Table, Math, String",more_than_6m
543,https://leetcode.com/problems/diameter-of-binary-tree,Diameter of Binary Tree,Easy,,43.2%,"Tree, Depth-First Search, Binary Tree",more_than_6m
1207,https://leetcode.com/problems/unique-number-of-occurrences,Unique Number of Occurrences,Easy,,43.2%,"Array, Hash Table",more_than_6m
29,https://leetcode.com/problems/divide-two-integers,Divide Two Integers,Medium,,43.2%,"Math, Bit Manipulation",more_than_6m
130,https://leetcode.com/problems/surrounded-regions,Surrounded Regions,Medium,,43.2%,"Array, Depth-First Search, Breadth-First Search, Union-Find, Matrix",more_than_6m
226,https://leetcode.com/problems/invert-binary-tree,Invert Binary Tree,Easy,,43.2%,"Tree, Depth-First Search, Breadth-First Search, Binary Tree",more_than_6m
2337,https://leetcode.com/problems/move-pieces-to-obtain-a-string,Move Pieces to Obtain a String,Medium,,43.2%,"Two Pointers, String",more_than_6m
448,https://leetcode.com/problems/find-all-numbers-disappeared-in-an-array,Find All Numbers Disappeared in an Array,Easy,,42.8%,"Array, Hash Table",more_than_6m
76,https://leetcode.com/problems/minimum-window-substring,Minimum Window Substring,Hard,,42.8%,"Hash Table, String, Sliding Window",more_than_6m
493,https://leetcode.com/problems/reverse-pairs,Reverse Pairs,Hard,,42.8%,"Array, Binary Search, Divide and Conquer, Binary Indexed Tree, Segment Tree, Merge Sort, Ordered Set",more_than_6m
739,https://leetcode.com/problems/daily-temperatures,Daily Temperatures,Medium,,42.8%,"Array, Stack, Monotonic Stack",more_than_6m
1071,https://leetcode.com/problems/greatest-common-divisor-of-strings,Greatest Common Divisor of Strings,Easy,,42.8%,"Math, String",more_than_6m
57,https://leetcode.com/problems/insert-interval,Insert Interval,Medium,,42.4%,Array,more_than_6m
139,https://leetcode.com/problems/word-break,Word Break,Medium,,42.4%,"Array, Hash Table, String, Dynamic Programming, Trie, Memoization",more_than_6m
179,https://leetcode.com/problems/largest-number,Largest Number,Medium,,42.4%,"Array, String, Greedy, Sorting",more_than_6m
229,https://leetcode.com/problems/majority-element-ii,Majority Element II,Medium,,42.4%,"Array, Hash Table, Sorting, Counting",more_than_6m
1825,https://leetcode.com/problems/finding-mk-average,Finding MK Average,Hard,,42.4%,"Design, Queue, Heap (Priority Queue), Data Stream, Ordered Set",more_than_6m
236,https://leetcode.com/problems/lowest-common-ancestor-of-a-binary-tree,Lowest Common Ancestor of a Binary Tree,Medium,,41.9%,"Tree, Depth-First Search, Binary Tree",more_than_6m
326,https://leetcode.com/problems/power-of-three,Power of Three,Easy,,41.9%,"Math, Recursion",more_than_6m
1480,https://leetcode.com/problems/running-sum-of-1d-array,Running Sum of 1d Array,Easy,,41.9%,"Array, Prefix Sum",more_than_6m
44,https://leetcode.com/problems/wildcard-matching,Wildcard Matching,Hard,,41.9%,"String, Dynamic Programming, Greedy, Recursion",more_than_6m
2402,https://leetcode.com/problems/meeting-rooms-iii,Meeting Rooms III,Hard,,41.9%,"Array, Hash Table, Sorting, Heap (Priority Queue), Simulation",more_than_6m
528,https://leetcode.com/problems/random-pick-with-weight,Random Pick with Weight,Medium,,41.9%,"Array, Math, Binary Search, Prefix Sum, Randomized",more_than_6m
268,https://leetcode.com/problems/missing-number,Missing Number,Easy,,41.5%,"Array, Hash Table, Math, Binary Search, Bit Manipulation, Sorting",more_than_6m
547,https://leetcode.com/problems/number-of-provinces,Number of Provinces,Medium,,41.5%,"Depth-First Search, Breadth-First Search, Union-Find, Graph Theory",more_than_6m
1011,https://leetcode.com/problems/capacity-to-ship-packages-within-d-days,Capacity To Ship Packages Within D Days,Medium,,41.5%,"Array, Binary Search",more_than_6m
3356,https://leetcode.com/problems/zero-array-transformation-ii,Zero Array Transformation II,Medium,,41.5%,"Array, Two Pointers, Binary Search, Prefix Sum",more_than_6m
127,https://leetcode.com/problems/word-ladder,Word Ladder,Hard,,41.0%,"Hash Table, String, Breadth-First Search",more_than_6m
197,https://leetcode.com/problems/rising-temperature,Rising Temperature,Easy,,41.0%,Database,more_than_6m
344,https://leetcode.com/problems/reverse-string,Reverse String,Easy,,41.0%,"Two Pointers, String",more_than_6m
345,https://leetcode.com/problems/reverse-vowels-of-a-string,Reverse Vowels of a String,Easy,,41.0%,"Two Pointers, String",more_than_6m
389,https://leetcode.com/problems/find-the-difference,Find the Difference,Easy,,41.0%,"Hash Table, String, Bit Manipulation, Sorting",more_than_6m
392,https://leetcode.com/problems/is-subsequence,Is Subsequence,Easy,,41.0%,"Two Pointers, String, Dynamic Programming",more_than_6m
101,https://leetcode.com/problems/symmetric-tree,Symmetric Tree,Easy,,41.0%,"Tree, Depth-First Search, Breadth-First Search, Binary Tree",more_than_6m
148,https://leetcode.com/problems/sort-list,Sort List,Medium,,41.0%,"Linked List, Two Pointers, Divide and Conquer, Sorting, Merge Sort",more_than_6m
977,https://leetcode.com/problems/squares-of-a-sorted-array,Squares of a Sorted Array,Easy,,40.6%,"Array, Two Pointers, Sorting",more_than_6m
8,https://leetcode.com/problems/string-to-integer-atoi,String to Integer (atoi),Medium,,40.6%,String,more_than_6m
134,https://leetcode.com/problems/gas-station,Gas Station,Medium,,40.6%,"Array, Greedy",more_than_6m
138,https://leetcode.com/problems/copy-list-with-random-pointer,Copy List with Random Pointer,Medium,,40.6%,"Hash Table, Linked List",more_than_6m
1838,https://leetcode.com/problems/frequency-of-the-most-frequent-element,Frequency of the Most Frequent Element,Medium,,40.6%,"Array, Binary Search, Greedy, Sliding Window, Sorting, Prefix Sum",more_than_6m
102,https://leetcode.com/problems/binary-tree-level-order-traversal,Binary Tree Level Order Traversal,Medium,,40.1%,"Tree, Breadth-First Search, Binary Tree",more_than_6m
1143,https://leetcode.com/problems/longest-common-subsequence,Longest Common Subsequence,Medium,,40.1%,"String, Dynamic Programming",more_than_6m
1661,https://leetcode.com/problems/average-time-of-process-per-machine,Average Time of Process per Machine,Easy,,40.1%,Database,more_than_6m
74,https://leetcode.com/problems/search-a-2d-matrix,Search a 2D Matrix,Medium,,40.1%,"Array, Binary Search, Matrix",more_than_6m
278,https://leetcode.com/problems/first-bad-version,First Bad Version,Easy,,40.1%,"Binary Search, Interactive",more_than_6m
328,https://leetcode.com/problems/odd-even-linked-list,Odd Even Linked List,Medium,,40.1%,Linked List,more_than_6m
417,https://leetcode.com/problems/pacific-atlantic-water-flow,Pacific Atlantic Water Flow,Medium,,40.1%,"Array, Depth-First Search, Breadth-First Search, Matrix",more_than_6m
494,https://leetcode.com/problems/target-sum,Target Sum,Medium,,40.1%,"Array, Dynamic Programming, Backtracking",more_than_6m
92,https://leetcode.com/problems/reverse-linked-list-ii,Reverse Linked List II,Medium,,39.6%,Linked List,more_than_6m
496,https://leetcode.com/problems/next-greater-element-i,Next Greater Element I,Easy,,39.6%,"Array, Hash Table, Stack, Monotonic Stack",more_than_6m
209,https://leetcode.com/problems/minimum-size-subarray-sum,Minimum Size Subarray Sum,Medium,,39.6%,"Array, Binary Search, Sliding Window, Prefix Sum",more_than_6m
1110,https://leetcode.com/problems/delete-nodes-and-return-forest,Delete Nodes And Return Forest,Medium,,39.6%,"Array, Hash Table, Tree, Depth-First Search, Binary Tree",more_than_6m
103,https://leetcode.com/problems/binary-tree-zigzag-level-order-traversal,Binary Tree Zigzag Level Order Traversal,Medium,,39.1%,"Tree, Breadth-First Search, Binary Tree",more_than_6m
412,https://leetcode.com/problems/fizz-buzz,Fizz Buzz,Easy,,39.1%,"Math, String, Simulation",more_than_6m
137,https://leetcode.com/problems/single-number-ii,Single Number II,Medium,,39.1%,"Array, Bit Manipulation",more_than_6m
160,https://leetcode.com/problems/intersection-of-two-linked-lists,Intersection of Two Linked Lists,Easy,,39.1%,"Hash Table, Linked List, Two Pointers",more_than_6m
605,https://leetcode.com/problems/can-place-flowers,Can Place Flowers,Easy,,39.1%,"Array, Greedy",more_than_6m
643,https://leetcode.com/problems/maximum-average-subarray-i,Maximum Average Subarray I,Easy,,39.1%,"Array, Sliding Window",more_than_6m
962,https://leetcode.com/problems/maximum-width-ramp,Maximum Width Ramp,Medium,,39.1%,"Array, Two Pointers, Stack, Monotonic Stack",more_than_6m
143,https://leetcode.com/problems/reorder-list,Reorder List,Medium,,38.6%,"Linked List, Two Pointers, Stack, Recursion",more_than_6m
240,https://leetcode.com/problems/search-a-2d-matrix-ii,Search a 2D Matrix II,Medium,,38.6%,"Array, Binary Search, Divide and Conquer, Matrix",more_than_6m
735,https://leetcode.com/problems/asteroid-collision,Asteroid Collision,Medium,,38.6%,"Array, Stack, Simulation",more_than_6m
796,https://leetcode.com/problems/rotate-string,Rotate String,Easy,,38.6%,"String, String Matching",more_than_6m
2620,https://leetcode.com/problems/counter,Counter,Easy,,38.6%,,more_than_6m
153,https://leetcode.com/problems/find-minimum-in-rotated-sorted-array,Find Minimum in Rotated Sorted Array,Medium,,38.6%,"Array, Binary Search",more_than_6m
230,https://leetcode.com/problems/kth-smallest-element-in-a-bst,Kth Smallest Element in a BST,Medium,,38.6%,"Tree, Depth-First Search, Binary Search Tree, Binary Tree",more_than_6m
312,https://leetcode.com/problems/burst-balloons,Burst Balloons,Hard,,38.6%,"Array, Dynamic Programming",more_than_6m
503,https://leetcode.com/problems/next-greater-element-ii,Next Greater Element II,Medium,,38.6%,"Array, Stack, Monotonic Stack",more_than_6m
621,https://leetcode.com/problems/task-scheduler,Task Scheduler,Medium,,38.6%,"Array, Hash Table, Greedy, Sorting, Heap (Priority Queue), Counting",more_than_6m
670,https://leetcode.com/problems/maximum-swap,Maximum Swap,Medium,,38.6%,"Math, Greedy",more_than_6m
181,https://leetcode.com/problems/employees-earning-more-than-their-managers,Employees Earning More Than Their Managers,Easy,,38.0%,Database,more_than_6m
225,https://leetcode.com/problems/implement-stack-using-queues,Implement Stack using Queues,Easy,,38.0%,"Stack, Design, Queue",more_than_6m
368,https://leetcode.com/problems/largest-divisible-subset,Largest Divisible Subset,Medium,,38.0%,"Array, Math, Dynamic Programming, Sorting",more_than_6m
525,https://leetcode.com/problems/contiguous-array,Contiguous Array,Medium,,38.0%,"Array, Hash Table, Prefix Sum",more_than_6m
80,https://leetcode.com/problems/remove-duplicates-from-sorted-array-ii,Remove Duplicates from Sorted Array II,Medium,,38.0%,"Array, Two Pointers",more_than_6m
83,https://leetcode.com/problems/remove-duplicates-from-sorted-list,Remove Duplicates from Sorted List,Easy,,38.0%,Linked List,more_than_6m
94,https://leetcode.com/problems/binary-tree-inorder-traversal,Binary Tree Inorder Traversal,Easy,,38.0%,"Stack, Tree, Depth-First Search, Binary Tree",more_than_6m
679,https://leetcode.com/problems/24-game,24 Game,Hard,,38.0%,"Array, Math, Backtracking",more_than_6m
987,https://leetcode.com/problems/vertical-order-traversal-of-a-binary-tree,Vertical Order Traversal of a Binary Tree,Hard,,38.0%,"Hash Table, Tree, Depth-First Search, Breadth-First Search, Sorting, Binary Tree",more_than_6m
64,https://leetcode.com/problems/minimum-path-sum,Minimum Path Sum,Medium,,37.5%,"Array, Dynamic Programming, Matrix",more_than_6m
279,https://leetcode.com/problems/perfect-squares,Perfect Squares,Medium,,37.5%,"Math, Dynamic Programming, Breadth-First Search",more_than_6m
415,https://leetcode.com/problems/add-strings,Add Strings,Easy,,37.5%,"Math, String, Simulation",more_than_6m
518,https://leetcode.com/problems/coin-change-ii,Coin Change II,Medium,,37.5%,"Array, Dynamic Programming",more_than_6m
680,https://leetcode.com/problems/valid-palindrome-ii,Valid Palindrome II,Easy,,37.5%,"Two Pointers, String, Greedy",more_than_6m
767,https://leetcode.com/problems/reorganize-string,Reorganize String,Medium,,37.5%,"Hash Table, String, Greedy, Sorting, Heap (Priority Queue), Counting",more_than_6m
32,https://leetcode.com/problems/longest-valid-parentheses,Longest Valid Parentheses,Hard,,37.5%,"String, Dynamic Programming, Stack",more_than_6m
150,https://leetcode.com/problems/evaluate-reverse-polish-notation,Evaluate Reverse Polish Notation,Medium,,37.5%,"Array, Math, Stack",more_than_6m
213,https://leetcode.com/problems/house-robber-ii,House Robber II,Medium,,37.5%,"Array, Dynamic Programming",more_than_6m
371,https://leetcode.com/problems/sum-of-two-integers,Sum of Two Integers,Medium,,37.5%,"Math, Bit Manipulation",more_than_6m
1482,https://leetcode.com/problems/minimum-number-of-days-to-make-m-bouquets,Minimum Number of Days to Make m Bouquets,Medium,,37.5%,"Array, Binary Search",more_than_6m
24,https://leetcode.com/problems/swap-nodes-in-pairs,Swap Nodes in Pairs,Medium,,36.9%,"Linked List, Recursion",more_than_6m
43,https://leetcode.com/problems/multiply-strings,Multiply Strings,Medium,,36.9%,"Math, String, Simulation",more_than_6m
228,https://leetcode.com/problems/summary-ranges,Summary Ranges,Easy,,36.9%,Array,more_than_6m
387,https://leetcode.com/problems/first-unique-character-in-a-string,First Unique Character in a String,Easy,,36.9%,"Hash Table, String, Queue, Counting",more_than_6m
407,https://leetcode.com/problems/trapping-rain-water-ii,Trapping Rain Water II,Hard,,36.9%,"Array, Breadth-First Search, Heap (Priority Queue), Matrix",more_than_6m
901,https://leetcode.com/problems/online-stock-span,Online Stock Span,Medium,,36.9%,"Stack, Design, Monotonic Stack, Data Stream",more_than_6m
142,https://leetcode.com/problems/linked-list-cycle-ii,Linked List Cycle II,Medium,,36.9%,"Hash Table, Linked List, Two Pointers",more_than_6m
273,https://leetcode.com/problems/integer-to-english-words,Integer to English Words,Hard,,36.9%,"Math, String, Recursion",more_than_6m
658,https://leetcode.com/problems/find-k-closest-elements,Find K Closest Elements,Medium,,36.9%,"Array, Two Pointers, Binary Search, Sliding Window, Sorting, Heap (Priority Queue)",more_than_6m
930,https://leetcode.com/problems/binary-subarrays-with-sum,Binary Subarrays With Sum,Medium,,36.9%,"Array, Hash Table, Sliding Window, Prefix Sum",more_than_6m
81,https://leetcode.com/problems/search-in-rotated-sorted-array-ii,Search in Rotated Sorted Array II,Medium,,36.9%,"Array, Binary Search",more_than_6m
2965,https://leetcode.com/problems/find-missing-and-repeated-values,Find Missing and Repeated Values,Easy,,36.9%,"Array, Hash Table, Math, Matrix",more_than_6m
60,https://leetcode.com/problems/permutation-sequence,Permutation Sequence,Hard,,36.3%,"Math, Recursion",more_than_6m
214,https://leetcode.com/problems/shortest-palindrome,Shortest Palindrome,Hard,,36.3%,"String, Rolling Hash, String Matching, Hash Function",more_than_6m
71,https://leetcode.com/problems/simplify-path,Simplify Path,Medium,,36.3%,"String, Stack",more_than_6m
104,https://leetcode.com/problems/maximum-depth-of-binary-tree,Maximum Depth of Binary Tree,Easy,,36.3%,"Tree, Depth-First Search, Breadth-First Search, Binary Tree",more_than_6m
210,https://leetcode.com/problems/course-schedule-ii,Course Schedule II,Medium,,36.3%,"Depth-First Search, Breadth-First Search, Graph Theory, Topological Sort",more_than_6m
237,https://leetcode.com/problems/delete-node-in-a-linked-list,Delete Node in a Linked List,Medium,,36.3%,Linked List,more_than_6m
442,https://leetcode.com/problems/find-all-duplicates-in-an-array,Find All Duplicates in an Array,Medium,,36.3%,"Array, Hash Table, Sorting",more_than_6m
721,https://leetcode.com/problems/accounts-merge,Accounts Merge,Medium,,36.3%,"Array, Hash Table, String, Depth-First Search, Breadth-First Search, Union-Find, Sorting",more_than_6m
1293,https://leetcode.com/problems/shortest-path-in-a-grid-with-obstacles-elimination,Shortest Path in a Grid with Obstacles Elimination,Hard,,36.3%,"Array, Breadth-First Search, Matrix",more_than_6m
133,https://leetcode.com/problems/clone-graph,Clone Graph,Medium,,35.6%,"Hash Table, Depth-First Search, Breadth-First Search, Graph Theory",more_than_6m
258,https://leetcode.com/problems/add-digits,Add Digits,Easy,,35.6%,"Math, Simulation, Number Theory",more_than_6m
383,https://leetcode.com/problems/ransom-note,Ransom Note,Easy,,35.6%,"Hash Table, String, Counting",more_than_6m
570,https://leetcode.com/problems/managers-with-at-least-5-direct-reports,Managers with at Least 5 Direct Reports,Medium,,35.6%,Database,more_than_6m
867,https://leetcode.com/problems/transpose-matrix,Transpose Matrix,Easy,,35.6%,"Array, Matrix, Simulation",more_than_6m
1930,https://leetcode.com/problems/unique-length-3-palindromic-subsequences,Unique Length-3 Palindromic Subsequences,Medium,,35.6%,"Hash Table, String, Bit Manipulation, Prefix Sum",more_than_6m
297,https://leetcode.com/problems/serialize-and-deserialize-binary-tree,Serialize and Deserialize Binary Tree,Hard,,35.6%,"String, Tree, Depth-First Search, Breadth-First Search, Design, Binary Tree",more_than_6m
577,https://leetcode.com/problems/employee-bonus,Employee Bonus,Easy,,35.6%,Database,more_than_6m
1091,https://leetcode.com/problems/shortest-path-in-binary-matrix,Shortest Path in Binary Matrix,Medium,,35.6%,"Array, Breadth-First Search, Matrix",more_than_6m
1251,https://leetcode.com/problems/average-selling-price,Average Selling Price,Easy,,35.6%,Database,more_than_6m
2663,https://leetcode.com/problems/lexicographically-smallest-beautiful-string,Lexicographically Smallest Beautiful String,Hard,,35.6%,"String, Greedy",more_than_6m
3024,https://leetcode.com/problems/type-of-triangle,Type of Triangle,Easy,,35.6%,"Array, Math, Sorting",more_than_6m
105,https://leetcode.com/problems/construct-binary-tree-from-preorder-and-inorder-traversal,Construct Binary Tree from Preorder and Inorder Traversal,Medium,,35.0%,"Array, Hash Table, Divide and Conquer, Tree, Binary Tree",more_than_6m
203,https://leetcode.com/problems/remove-linked-list-elements,Remove Linked List Elements,Easy,,35.0%,"Linked List, Recursion",more_than_6m
282,https://leetcode.com/problems/expression-add-operators,Expression Add Operators,Hard,,35.0%,"Math, String, Backtracking",more_than_6m
