ID,URL,Title,Difficulty,Acceptance %,Frequency %,Topics,Timeframe
1591,https://leetcode.com/problems/strange-printer-ii,Strange Printer II,Hard,,21.0%,"Array, Graph Theory, Topological Sort, Matrix",all
1592,https://leetcode.com/problems/rearrange-spaces-between-words,Rearrange Spaces Between Words,Easy,,21.0%,String,all
1595,https://leetcode.com/problems/minimum-cost-to-connect-two-groups-of-points,Minimum Cost to Connect Two Groups of Points,Hard,,21.0%,"Array, Dynamic Programming, Bit Manipulation, Matrix, Bitmask",all
1600,https://leetcode.com/problems/throne-inheritance,Throne Inheritance,Medium,,21.0%,"Hash Table, Tree, Depth-First Search, Design",all
1622,https://leetcode.com/problems/fancy-sequence,Fancy Sequence,Hard,,21.0%,"Math, Design, Segment Tree, Number Theory",all
1655,https://leetcode.com/problems/distribute-repeating-integers,Distribute Repeating Integers,Hard,,21.0%,"Array, Hash Table, Dynamic Programming, Backtracking, Bit Manipulation, Counting, Bitmask",all
1679,https://leetcode.com/problems/max-number-of-k-sum-pairs,Max Number of K-Sum Pairs,Medium,,21.0%,"Array, Hash Table, Two Pointers, Sorting",all
1713,https://leetcode.com/problems/minimum-operations-to-make-a-subsequence,Minimum Operations to Make a Subsequence,Hard,,21.0%,"Array, Hash Table, Binary Search, Greedy",all
1738,https://leetcode.com/problems/find-kth-largest-xor-coordinate-value,Find Kth Largest XOR Coordinate Value,Medium,,21.0%,"Array, Divide and Conquer, Bit Manipulation, Sorting, Heap (Priority Queue), Matrix, Prefix Sum, Quickselect",all
1770,https://leetcode.com/problems/maximum-score-from-performing-multiplication-operations,Maximum Score from Performing Multiplication Operations,Hard,,21.0%,"Array, Dynamic Programming",all
1756,https://leetcode.com/problems/design-most-recently-used-queue,Design Most Recently Used Queue,Medium,,21.0%,"Array, Linked List, Divide and Conquer, Design, Simulation, Doubly-Linked List",all
1815,https://leetcode.com/problems/maximum-number-of-groups-getting-fresh-donuts,Maximum Number of Groups Getting Fresh Donuts,Hard,,21.0%,"Array, Dynamic Programming, Bit Manipulation, Memoization, Bitmask",all
1810,https://leetcode.com/problems/minimum-path-cost-in-a-hidden-grid,Minimum Path Cost in a Hidden Grid,Medium,,21.0%,"Array, Depth-First Search, Breadth-First Search, Graph Theory, Heap (Priority Queue), Matrix, Interactive, Shortest Path",all
1918,https://leetcode.com/problems/kth-smallest-subarray-sum,Kth Smallest Subarray Sum,Medium,,21.0%,"Array, Binary Search, Sliding Window",all
1970,https://leetcode.com/problems/last-day-where-you-can-still-cross,Last Day Where You Can Still Cross,Hard,,21.0%,"Array, Binary Search, Depth-First Search, Breadth-First Search, Union-Find, Matrix",all
1993,https://leetcode.com/problems/operations-on-tree,Operations on Tree,Medium,,21.0%,"Array, Hash Table, Tree, Depth-First Search, Breadth-First Search, Design",all
1966,https://leetcode.com/problems/binary-searchable-numbers-in-an-unsorted-array,Binary Searchable Numbers in an Unsorted Array,Medium,,21.0%,"Array, Binary Search, Stack, Monotonic Stack",all
2011,https://leetcode.com/problems/final-value-of-variable-after-performing-operations,Final Value of Variable After Performing Operations,Easy,,21.0%,"Array, String, Simulation",all
2059,https://leetcode.com/problems/minimum-operations-to-convert-number,Minimum Operations to Convert Number,Medium,,21.0%,"Array, Breadth-First Search",all
2162,https://leetcode.com/problems/minimum-cost-to-set-cooking-time,Minimum Cost to Set Cooking Time,Medium,,21.0%,"Math, Enumeration",all
2150,https://leetcode.com/problems/find-all-lonely-numbers-in-the-array,Find All Lonely Numbers in the Array,Medium,,21.0%,"Array, Hash Table, Counting",all
2178,https://leetcode.com/problems/maximum-split-of-positive-even-integers,Maximum Split of Positive Even Integers,Medium,,21.0%,"Math, Backtracking, Greedy",all
2167,https://leetcode.com/problems/minimum-time-to-remove-all-cars-containing-illegal-goods,Minimum Time to Remove All Cars Containing Illegal Goods,Hard,,21.0%,"String, Dynamic Programming",all
2172,https://leetcode.com/problems/maximum-and-sum-of-array,Maximum AND Sum of Array,Hard,,21.0%,"Array, Dynamic Programming, Bit Manipulation, Bitmask",all
2255,https://leetcode.com/problems/count-prefixes-of-a-given-string,Count Prefixes of a Given String,Easy,,21.0%,"Array, String",all
2315,https://leetcode.com/problems/count-asterisks,Count Asterisks,Easy,,21.0%,String,all
2363,https://leetcode.com/problems/merge-similar-items,Merge Similar Items,Easy,,21.0%,"Array, Hash Table, Sorting, Ordered Set",all
2345,https://leetcode.com/problems/finding-the-number-of-visible-mountains,Finding the Number of Visible Mountains,Medium,,21.0%,"Array, Stack, Sorting, Monotonic Stack",all
2424,https://leetcode.com/problems/longest-uploaded-prefix,Longest Uploaded Prefix,Medium,,21.0%,"Hash Table, Binary Search, Union-Find, Design, Binary Indexed Tree, Segment Tree, Heap (Priority Queue), Ordered Set",all
2426,https://leetcode.com/problems/number-of-pairs-satisfying-inequality,Number of Pairs Satisfying Inequality,Hard,,21.0%,"Array, Binary Search, Divide and Conquer, Binary Indexed Tree, Segment Tree, Merge Sort, Ordered Set",all
2478,https://leetcode.com/problems/number-of-beautiful-partitions,Number of Beautiful Partitions,Hard,,21.0%,"String, Dynamic Programming, Prefix Sum",all
2531,https://leetcode.com/problems/make-number-of-distinct-characters-equal,Make Number of Distinct Characters Equal,Medium,,21.0%,"Hash Table, String, Counting",all
2536,https://leetcode.com/problems/increment-submatrices-by-one,Increment Submatrices by One,Medium,,21.0%,"Array, Matrix, Prefix Sum",all
2621,https://leetcode.com/problems/sleep,Sleep,Easy,,21.0%,,all
2763,https://leetcode.com/problems/sum-of-imbalance-numbers-of-all-subarrays,Sum of Imbalance Numbers of All Subarrays,Hard,,21.0%,"Array, Hash Table, Enumeration",all
2817,https://leetcode.com/problems/minimum-absolute-difference-between-elements-with-constraint,Minimum Absolute Difference Between Elements With Constraint,Medium,,21.0%,"Array, Binary Search, Ordered Set",all
2842,https://leetcode.com/problems/count-k-subsequences-of-a-string-with-maximum-beauty,Count K-Subsequences of a String With Maximum Beauty,Hard,,21.0%,"Hash Table, Math, String, Greedy, Sorting, Combinatorics",all
2924,https://leetcode.com/problems/find-champion-ii,Find Champion II,Medium,,21.0%,Graph Theory,all
2982,https://leetcode.com/problems/find-longest-special-substring-that-occurs-thrice-ii,Find Longest Special Substring That Occurs Thrice II,Medium,,21.0%,"Hash Table, String, Binary Search, Sliding Window, Counting",all
3137,https://leetcode.com/problems/minimum-number-of-operations-to-make-word-k-periodic,Minimum Number of Operations to Make Word K-Periodic,Medium,,21.0%,"Hash Table, String, Counting",all
3153,https://leetcode.com/problems/sum-of-digit-differences-of-all-pairs,Sum of Digit Differences of All Pairs,Medium,,21.0%,"Array, Hash Table, Math, Counting",all
2104,https://leetcode.com/problems/sum-of-subarray-ranges,Sum of Subarray Ranges,Medium,,21.0%,"Array, Stack, Monotonic Stack",all
247,https://leetcode.com/problems/strobogrammatic-number-ii,Strobogrammatic Number II,Medium,,21.0%,"Array, String, Recursion",all
252,https://leetcode.com/problems/meeting-rooms,Meeting Rooms,Easy,,21.0%,"Array, Sorting",all
379,https://leetcode.com/problems/design-phone-directory,Design Phone Directory,Medium,,21.0%,"Array, Hash Table, Linked List, Design, Queue",all
395,https://leetcode.com/problems/longest-substring-with-at-least-k-repeating-characters,Longest Substring with At Least K Repeating Characters,Medium,,21.0%,"Hash Table, String, Divide and Conquer, Sliding Window",all
2437,https://leetcode.com/problems/number-of-valid-clock-times,Number of Valid Clock Times,Easy,,21.0%,"String, Enumeration",all
587,https://leetcode.com/problems/erect-the-fence,Erect the Fence,Hard,,21.0%,"Array, Math, Geometry",all
616,https://leetcode.com/problems/add-bold-tag-in-string,Add Bold Tag in String,Medium,,21.0%,"Array, Hash Table, String, Trie, String Matching",all
700,https://leetcode.com/problems/search-in-a-binary-search-tree,Search in a Binary Search Tree,Easy,,21.0%,"Tree, Binary Search Tree, Binary Tree",all
846,https://leetcode.com/problems/hand-of-straights,Hand of Straights,Medium,,21.0%,"Array, Hash Table, Greedy, Sorting",all
879,https://leetcode.com/problems/profitable-schemes,Profitable Schemes,Hard,,21.0%,"Array, Dynamic Programming",all
887,https://leetcode.com/problems/super-egg-drop,Super Egg Drop,Hard,,21.0%,"Math, Binary Search, Dynamic Programming",all
979,https://leetcode.com/problems/distribute-coins-in-binary-tree,Distribute Coins in Binary Tree,Medium,,21.0%,"Tree, Depth-First Search, Binary Tree",all
2863,https://leetcode.com/problems/maximum-length-of-semi-decreasing-subarrays,Maximum Length of Semi-Decreasing Subarrays,Medium,,21.0%,"Array, Stack, Sorting, Monotonic Stack",all
1046,https://leetcode.com/problems/last-stone-weight,Last Stone Weight,Easy,,21.0%,"Array, Heap (Priority Queue)",all
1106,https://leetcode.com/problems/parsing-a-boolean-expression,Parsing A Boolean Expression,Hard,,21.0%,"String, Stack, Recursion",all
1290,https://leetcode.com/problems/convert-binary-number-in-a-linked-list-to-integer,Convert Binary Number in a Linked List to Integer,Easy,,21.0%,"Linked List, Math",all
1605,https://leetcode.com/problems/find-valid-matrix-given-row-and-column-sums,Find Valid Matrix Given Row and Column Sums,Medium,,21.0%,"Array, Greedy, Matrix",all
1616,https://leetcode.com/problems/split-two-strings-to-make-palindrome,Split Two Strings to Make Palindrome,Medium,,21.0%,"Two Pointers, String",all
1700,https://leetcode.com/problems/number-of-students-unable-to-eat-lunch,Number of Students Unable to Eat Lunch,Easy,,21.0%,"Array, Stack, Queue, Simulation",all
1844,https://leetcode.com/problems/replace-all-digits-with-characters,Replace All Digits with Characters,Easy,,21.0%,String,all
1721,https://leetcode.com/problems/swapping-nodes-in-a-linked-list,Swapping Nodes in a Linked List,Medium,,21.0%,"Linked List, Two Pointers",all
3020,https://leetcode.com/problems/find-the-maximum-number-of-elements-in-subset,Find the Maximum Number of Elements in Subset,Medium,,21.0%,"Array, Hash Table, Enumeration",all
3208,https://leetcode.com/problems/alternating-groups-ii,Alternating Groups II,Medium,,21.0%,"Array, Sliding Window",all
2094,https://leetcode.com/problems/finding-3-digit-even-numbers,Finding 3-Digit Even Numbers,Easy,,21.0%,"Array, Hash Table, Recursion, Sorting, Enumeration",all
728,https://leetcode.com/problems/self-dividing-numbers,Self Dividing Numbers,Easy,,21.0%,Math,all
3454,https://leetcode.com/problems/separate-squares-ii,Separate Squares II,Hard,,21.0%,"Array, Binary Search, Segment Tree, Sweep Line",all
1128,https://leetcode.com/problems/number-of-equivalent-domino-pairs,Number of Equivalent Domino Pairs,Easy,,21.0%,"Array, Hash Table, Counting",all
3574,https://leetcode.com/problems/maximize-subarray-gcd-score,Maximize Subarray GCD Score,Hard,,21.0%,"Array, Math, Enumeration, Number Theory",all
3597,https://leetcode.com/problems/partition-string,Partition String,Medium,,21.0%,"Hash Table, String, Trie, Simulation",all
2574,https://leetcode.com/problems/left-and-right-sum-differences,Left and Right Sum Differences,Easy,,21.0%,"Array, Prefix Sum",all
3477,https://leetcode.com/problems/fruits-into-baskets-ii,Fruits Into Baskets II,Easy,,21.0%,"Array, Binary Search, Segment Tree, Simulation, Ordered Set",all
869,https://leetcode.com/problems/reordered-power-of-2,Reordered Power of 2,Medium,,21.0%,"Hash Table, Math, Sorting, Counting, Enumeration",all
3650,https://leetcode.com/problems/minimum-cost-path-with-edge-reversals,Minimum Cost Path with Edge Reversals,Medium,,21.0%,"Graph Theory, Heap (Priority Queue), Shortest Path",all
52,https://leetcode.com/problems/n-queens-ii,N-Queens II,Hard,,19.6%,Backtracking,all
87,https://leetcode.com/problems/scramble-string,Scramble String,Hard,,19.6%,"String, Dynamic Programming",all
266,https://leetcode.com/problems/palindrome-permutation,Palindrome Permutation,Easy,,19.6%,"Hash Table, String, Bit Manipulation",all
288,https://leetcode.com/problems/unique-word-abbreviation,Unique Word Abbreviation,Medium,,19.6%,"Array, Hash Table, String, Design",all
293,https://leetcode.com/problems/flip-game,Flip Game,Easy,,19.6%,String,all
294,https://leetcode.com/problems/flip-game-ii,Flip Game II,Medium,,19.6%,"Math, Dynamic Programming, Backtracking, Memoization, Game Theory",all
320,https://leetcode.com/problems/generalized-abbreviation,Generalized Abbreviation,Medium,,19.6%,"String, Backtracking, Bit Manipulation",all
361,https://leetcode.com/problems/bomb-enemy,Bomb Enemy,Medium,,19.6%,"Array, Dynamic Programming, Matrix",all
411,https://leetcode.com/problems/minimum-unique-word-abbreviation,Minimum Unique Word Abbreviation,Hard,,19.6%,"Array, String, Backtracking, Bit Manipulation",all
422,https://leetcode.com/problems/valid-word-square,Valid Word Square,Easy,,19.6%,"Array, Matrix",all
425,https://leetcode.com/problems/word-squares,Word Squares,Hard,,19.6%,"Array, String, Backtracking, Trie",all
469,https://leetcode.com/problems/convex-polygon,Convex Polygon,Medium,,19.6%,"Array, Math, Geometry",all
471,https://leetcode.com/problems/encode-string-with-shortest-length,Encode String with Shortest Length,Hard,,19.6%,"String, Dynamic Programming",all
484,https://leetcode.com/problems/find-permutation,Find Permutation,Medium,,19.6%,"Array, String, Stack, Greedy",all
2031,https://leetcode.com/problems/count-subarrays-with-more-ones-than-zeros,Count Subarrays With More Ones Than Zeros,Medium,,19.6%,"Array, Hash Table, Binary Search, Divide and Conquer, Binary Indexed Tree, Segment Tree, Merge Sort, Ordered Set",all
521,https://leetcode.com/problems/longest-uncommon-subsequence-i,Longest Uncommon Subsequence I,Easy,,19.6%,String,all
531,https://leetcode.com/problems/lonely-pixel-i,Lonely Pixel I,Medium,,19.6%,"Array, Hash Table, Matrix",all
533,https://leetcode.com/problems/lonely-pixel-ii,Lonely Pixel II,Medium,,19.6%,"Array, Hash Table, Matrix",all
549,https://leetcode.com/problems/binary-tree-longest-consecutive-sequence-ii,Binary Tree Longest Consecutive Sequence II,Medium,,19.6%,"Tree, Depth-First Search, Binary Tree",all
568,https://leetcode.com/problems/maximum-vacation-days,Maximum Vacation Days,Hard,,19.6%,"Array, Dynamic Programming, Matrix",all
569,https://leetcode.com/problems/median-employee-salary,Median Employee Salary,Hard,,19.6%,Database,all
644,https://leetcode.com/problems/maximum-average-subarray-ii,Maximum Average Subarray II,Hard,,19.6%,"Array, Binary Search, Prefix Sum",all
651,https://leetcode.com/problems/4-keys-keyboard,4 Keys Keyboard,Medium,,19.6%,"Math, Dynamic Programming",all
656,https://leetcode.com/problems/coin-path,Coin Path,Hard,,19.6%,"Array, Dynamic Programming",all
673,https://leetcode.com/problems/number-of-longest-increasing-subsequence,Number of Longest Increasing Subsequence,Medium,,19.6%,"Array, Dynamic Programming, Binary Indexed Tree, Segment Tree",all
682,https://leetcode.com/problems/baseball-game,Baseball Game,Easy,,19.6%,"Array, Stack, Simulation",all
687,https://leetcode.com/problems/longest-univalue-path,Longest Univalue Path,Medium,,19.6%,"Tree, Depth-First Search, Binary Tree",all
758,https://leetcode.com/problems/bold-words-in-string,Bold Words in String,Medium,,19.6%,"Array, Hash Table, String, Trie, String Matching",all
430,https://leetcode.com/problems/flatten-a-multilevel-doubly-linked-list,Flatten a Multilevel Doubly Linked List,Medium,,19.6%,"Linked List, Depth-First Search, Doubly-Linked List",all
782,https://leetcode.com/problems/transform-to-chessboard,Transform to Chessboard,Hard,,19.6%,"Array, Math, Bit Manipulation, Matrix",all
800,https://leetcode.com/problems/similar-rgb-color,Similar RGB Color,Easy,,19.6%,"Math, String, Enumeration",all
816,https://leetcode.com/problems/ambiguous-coordinates,Ambiguous Coordinates,Medium,,19.6%,"String, Backtracking, Enumeration",all
830,https://leetcode.com/problems/positions-of-large-groups,Positions of Large Groups,Easy,,19.6%,String,all
710,https://leetcode.com/problems/random-pick-with-blacklist,Random Pick with Blacklist,Hard,,19.6%,"Array, Hash Table, Math, Binary Search, Sorting, Randomized",all
519,https://leetcode.com/problems/random-flip-matrix,Random Flip Matrix,Medium,,19.6%,"Hash Table, Math, Reservoir Sampling, Randomized",all
919,https://leetcode.com/problems/complete-binary-tree-inserter,Complete Binary Tree Inserter,Medium,,19.6%,"Tree, Breadth-First Search, Design, Binary Tree",all
954,https://leetcode.com/problems/array-of-doubled-pairs,Array of Doubled Pairs,Medium,,19.6%,"Array, Hash Table, Greedy, Sorting",all
997,https://leetcode.com/problems/find-the-town-judge,Find the Town Judge,Easy,,19.6%,"Array, Hash Table, Graph Theory",all
1055,https://leetcode.com/problems/shortest-way-to-form-string,Shortest Way to Form String,Medium,,19.6%,"Two Pointers, String, Binary Search, Greedy",all
1066,https://leetcode.com/problems/campus-bikes-ii,Campus Bikes II,Medium,,19.6%,"Array, Dynamic Programming, Backtracking, Bit Manipulation, Bitmask",all
1087,https://leetcode.com/problems/brace-expansion,Brace Expansion,Medium,,19.6%,"String, Backtracking, Stack, Breadth-First Search, Sorting",all
1088,https://leetcode.com/problems/confusing-number-ii,Confusing Number II,Hard,,19.6%,"Math, Backtracking",all
1023,https://leetcode.com/problems/camelcase-matching,Camelcase Matching,Medium,,19.6%,"Array, Two Pointers, String, Trie, String Matching",all
1121,https://leetcode.com/problems/divide-array-into-increasing-sequences,Divide Array Into Increasing Sequences,Hard,,19.6%,"Array, Counting",all
1043,https://leetcode.com/problems/partition-array-for-maximum-sum,Partition Array for Maximum Sum,Medium,,19.6%,"Array, Dynamic Programming",all
1153,https://leetcode.com/problems/string-transforms-into-another-string,String Transforms Into Another String,Hard,,19.6%,"Hash Table, String, Graph Theory",all
1182,https://leetcode.com/problems/shortest-distance-to-target-color,Shortest Distance to Target Color,Medium,,19.6%,"Array, Binary Search, Dynamic Programming",all
1168,https://leetcode.com/problems/optimize-water-distribution-in-a-village,Optimize Water Distribution in a Village,Hard,,19.6%,"Union-Find, Graph Theory, Heap (Priority Queue), Minimum Spanning Tree",all
1078,https://leetcode.com/problems/occurrences-after-bigram,Occurrences After Bigram,Easy,,19.6%,String,all
1199,https://leetcode.com/problems/minimum-time-to-build-blocks,Minimum Time to Build Blocks,Hard,,19.6%,"Array, Math, Greedy, Heap (Priority Queue)",all
1090,https://leetcode.com/problems/largest-values-from-labels,Largest Values From Labels,Medium,,19.6%,"Array, Hash Table, Greedy, Sorting, Counting",all
1245,https://leetcode.com/problems/tree-diameter,Tree Diameter,Medium,,19.6%,"Tree, Depth-First Search, Breadth-First Search, Graph Theory, Topological Sort",all
1286,https://leetcode.com/problems/iterator-for-combination,Iterator for Combination,Medium,,19.6%,"String, Backtracking, Design, Iterator",all
1170,https://leetcode.com/problems/compare-strings-by-frequency-of-the-smallest-character,Compare Strings by Frequency of the Smallest Character,Medium,,19.6%,"Array, Hash Table, String, Binary Search, Sorting",all
1184,https://leetcode.com/problems/distance-between-bus-stops,Distance Between Bus Stops,Easy,,19.6%,Array,all
1206,https://leetcode.com/problems/design-skiplist,Design Skiplist,Hard,,19.6%,"Linked List, Design",all
1618,https://leetcode.com/problems/maximum-font-to-fit-a-sentence-in-a-screen,Maximum Font to Fit a Sentence in a Screen,Medium,,19.6%,"Array, String, Binary Search, Interactive",all
1261,https://leetcode.com/problems/find-elements-in-a-contaminated-binary-tree,Find Elements in a Contaminated Binary Tree,Medium,,19.6%,"Hash Table, Tree, Depth-First Search, Breadth-First Search, Design, Binary Tree",all
2304,https://leetcode.com/problems/minimum-path-cost-in-a-grid,Minimum Path Cost in a Grid,Medium,,19.6%,"Array, Dynamic Programming, Matrix",all
1270,https://leetcode.com/problems/all-people-report-to-the-given-manager,All People Report to the Given Manager,Medium,,19.6%,Database,all
1351,https://leetcode.com/problems/count-negative-numbers-in-a-sorted-matrix,Count Negative Numbers in a Sorted Matrix,Easy,,19.6%,"Array, Binary Search, Matrix",all
1401,https://leetcode.com/problems/circle-and-rectangle-overlapping,Circle and Rectangle Overlapping,Medium,,19.6%,"Math, Geometry",all
1424,https://leetcode.com/problems/diagonal-traverse-ii,Diagonal Traverse II,Medium,,19.6%,"Array, Sorting, Heap (Priority Queue)",all
1449,https://leetcode.com/problems/form-largest-integer-with-digits-that-add-up-to-target,Form Largest Integer With Digits That Add up to Target,Hard,,19.6%,"Array, Dynamic Programming",all
1452,https://leetcode.com/problems/people-whose-list-of-favorite-companies-is-not-a-subset-of-another-list,People Whose List of Favorite Companies Is Not a Subset of Another List,Medium,,19.6%,"Array, Hash Table, String",all
1471,https://leetcode.com/problems/the-k-strongest-values-in-an-array,The k Strongest Values in an Array,Medium,,19.6%,"Array, Two Pointers, Sorting",all
1513,https://leetcode.com/problems/number-of-substrings-with-only-1s,Number of Substrings With Only 1s,Medium,,19.6%,"Math, String",all
1546,https://leetcode.com/problems/maximum-number-of-non-overlapping-subarrays-with-sum-equals-target,Maximum Number of Non-Overlapping Subarrays With Sum Equals Target,Medium,,19.6%,"Array, Hash Table, Greedy, Prefix Sum",all
1516,https://leetcode.com/problems/move-sub-tree-of-n-ary-tree,Move Sub-Tree of N-Ary Tree,Hard,,19.6%,"Tree, Depth-First Search",all
1538,https://leetcode.com/problems/guess-the-majority-in-a-hidden-array,Guess the Majority in a Hidden Array,Medium,,19.6%,"Array, Math, Interactive",all
1562,https://leetcode.com/problems/find-latest-group-of-size-m,Find Latest Group of Size M,Medium,,19.6%,"Array, Hash Table, Binary Search, Simulation",all
1548,https://leetcode.com/problems/the-most-similar-path-in-a-graph,The Most Similar Path in a Graph,Hard,,19.6%,"Array, String, Dynamic Programming, Graph Theory",all
1564,https://leetcode.com/problems/put-boxes-into-the-warehouse-i,Put Boxes Into the Warehouse I,Medium,,19.6%,"Array, Greedy, Sorting",all
1585,https://leetcode.com/problems/check-if-string-is-transformable-with-substring-sort-operations,Check If String Is Transformable With Substring Sort Operations,Hard,,19.6%,"String, Greedy, Sorting",all
1580,https://leetcode.com/problems/put-boxes-into-the-warehouse-ii,Put Boxes Into the Warehouse II,Medium,,19.6%,"Array, Greedy, Sorting",all
1639,https://leetcode.com/problems/number-of-ways-to-form-a-target-string-given-a-dictionary,Number of Ways to Form a Target String Given a Dictionary,Hard,,19.6%,"Array, String, Dynamic Programming",all
1602,https://leetcode.com/problems/find-nearest-right-node-in-binary-tree,Find Nearest Right Node in Binary Tree,Medium,,19.6%,"Tree, Breadth-First Search, Binary Tree",all
1612,https://leetcode.com/problems/check-if-two-expression-trees-are-equivalent,Check If Two Expression Trees are Equivalent,Medium,,19.6%,"Hash Table, Tree, Depth-First Search, Binary Tree, Counting",all
1660,https://leetcode.com/problems/correct-a-binary-tree,Correct a Binary Tree,Medium,,19.6%,"Hash Table, Tree, Depth-First Search, Breadth-First Search, Binary Tree",all
1666,https://leetcode.com/problems/change-the-root-of-a-binary-tree,Change the Root of a Binary Tree,Medium,,19.6%,"Tree, Depth-First Search, Binary Tree",all
1692,https://leetcode.com/problems/count-ways-to-distribute-candies,Count Ways to Distribute Candies,Hard,,19.6%,Dynamic Programming,all
1708,https://leetcode.com/problems/largest-subarray-length-k,Largest Subarray Length K,Easy,,19.6%,"Array, Greedy",all
1737,https://leetcode.com/problems/change-minimum-characters-to-satisfy-one-of-three-conditions,Change Minimum Characters to Satisfy One of Three Conditions,Medium,,19.6%,"Hash Table, String, Counting, Prefix Sum",all
1724,https://leetcode.com/problems/checking-existence-of-edge-length-limited-paths-ii,Checking Existence of Edge Length Limited Paths II,Hard,,19.6%,"Depth-First Search, Union-Find, Graph Theory, Design, Sorting, Heap (Priority Queue), Minimum Spanning Tree",all
1766,https://leetcode.com/problems/tree-of-coprimes,Tree of Coprimes,Hard,,19.6%,"Array, Math, Tree, Depth-First Search, Number Theory",all
1753,https://leetcode.com/problems/maximum-score-from-removing-stones,Maximum Score From Removing Stones,Medium,,19.6%,"Math, Greedy, Heap (Priority Queue)",all
1774,https://leetcode.com/problems/closest-dessert-cost,Closest Dessert Cost,Medium,,19.6%,"Array, Dynamic Programming, Backtracking",all
1767,https://leetcode.com/problems/find-the-subtasks-that-did-not-execute,Find the Subtasks That Did Not Execute,Hard,,19.6%,Database,all
1806,https://leetcode.com/problems/minimum-number-of-operations-to-reinitialize-a-permutation,Minimum Number of Operations to Reinitialize a Permutation,Medium,,19.6%,"Array, Math, Simulation",all
1794,https://leetcode.com/problems/count-pairs-of-equal-substrings-with-minimum-difference,Count Pairs of Equal Substrings With Minimum Difference,Medium,,19.6%,"Hash Table, String, Greedy",all
1821,https://leetcode.com/problems/find-customers-with-positive-revenue-this-year,Find Customers With Positive Revenue this Year,Easy,,19.6%,Database,all
1850,https://leetcode.com/problems/minimum-adjacent-swaps-to-reach-the-kth-smallest-number,Minimum Adjacent Swaps to Reach the Kth Smallest Number,Medium,,19.6%,"Two Pointers, String, Greedy",all
1866,https://leetcode.com/problems/number-of-ways-to-rearrange-sticks-with-k-sticks-visible,Number of Ways to Rearrange Sticks With K Sticks Visible,Hard,,19.6%,"Math, Dynamic Programming, Combinatorics",all
