ID,URL,Title,Difficulty,Acceptance %,Frequency %,Topics,Timeframe
3120,https://leetcode.com/problems/count-the-number-of-special-characters-i,Count the Number of Special Characters I,Easy,,7.0%,"Hash Table, String",more_than_6m
2477,https://leetcode.com/problems/minimum-fuel-cost-to-report-to-the-capital,Minimum Fuel Cost to Report to the Capital,Medium,,7.0%,"Tree, Depth-First Search, Breadth-First Search, Graph Theory",more_than_6m
3203,https://leetcode.com/problems/find-minimum-diameter-after-merging-two-trees,Find Minimum Diameter After Merging Two Trees,Hard,,7.0%,"Tree, Depth-First Search, Breadth-First Search, Graph Theory",more_than_6m
722,https://leetcode.com/problems/remove-comments,Remove Comments,Medium,,7.0%,"Array, String",more_than_6m
1010,https://leetcode.com/problems/pairs-of-songs-with-total-durations-divisible-by-60,Pairs of Songs With Total Durations Divisible by 60,Medium,,7.0%,"Array, Hash Table, Counting",more_than_6m
2800,https://leetcode.com/problems/shortest-string-that-contains-three-strings,Shortest String That Contains Three Strings,Medium,,7.0%,"String, Greedy, Enumeration",more_than_6m
1186,https://leetcode.com/problems/maximum-subarray-sum-with-one-deletion,Maximum Subarray Sum with One Deletion,Medium,,7.0%,"Array, Dynamic Programming",more_than_6m
810,https://leetcode.com/problems/chalkboard-xor-game,Chalkboard XOR Game,Hard,,7.0%,"Array, Math, Bit Manipulation, Brainteaser, Game Theory",more_than_6m
2263,https://leetcode.com/problems/make-array-non-decreasing-or-non-increasing,Make Array Non-decreasing or Non-increasing,Hard,,7.0%,"Array, Dynamic Programming, Greedy, Heap (Priority Queue)",more_than_6m
1385,https://leetcode.com/problems/find-the-distance-value-between-two-arrays,Find the Distance Value Between Two Arrays,Easy,,7.0%,"Array, Two Pointers, Binary Search, Sorting",more_than_6m
1356,https://leetcode.com/problems/sort-integers-by-the-number-of-1-bits,Sort Integers by The Number of 1 Bits,Easy,,7.0%,"Array, Bit Manipulation, Sorting, Counting",more_than_6m
3319,https://leetcode.com/problems/k-th-largest-perfect-subtree-size-in-binary-tree,K-th Largest Perfect Subtree Size in Binary Tree,Medium,,7.0%,"Tree, Depth-First Search, Sorting, Binary Tree",more_than_6m
773,https://leetcode.com/problems/sliding-puzzle,Sliding Puzzle,Hard,,7.0%,"Array, Dynamic Programming, Backtracking, Breadth-First Search, Memoization, Matrix",more_than_6m
1389,https://leetcode.com/problems/create-target-array-in-the-given-order,Create Target Array in the Given Order,Easy,,7.0%,"Array, Simulation",more_than_6m
2684,https://leetcode.com/problems/maximum-number-of-moves-in-a-grid,Maximum Number of Moves in a Grid,Medium,,7.0%,"Array, Dynamic Programming, Matrix",more_than_6m
2423,https://leetcode.com/problems/remove-letter-to-equalize-frequency,Remove Letter To Equalize Frequency,Easy,,7.0%,"Hash Table, String, Counting",more_than_6m
2413,https://leetcode.com/problems/smallest-even-multiple,Smallest Even Multiple,Easy,,7.0%,"Math, Number Theory",more_than_6m
1185,https://leetcode.com/problems/day-of-the-week,Day of the Week,Easy,,7.0%,Math,more_than_6m
1340,https://leetcode.com/problems/jump-game-v,Jump Game V,Hard,,7.0%,"Array, Dynamic Programming, Sorting",more_than_6m
866,https://leetcode.com/problems/prime-palindrome,Prime Palindrome,Medium,,7.0%,"Math, Number Theory",more_than_6m
2471,https://leetcode.com/problems/minimum-number-of-operations-to-sort-a-binary-tree-by-level,Minimum Number of Operations to Sort a Binary Tree by Level,Medium,,7.0%,"Tree, Breadth-First Search, Binary Tree",more_than_6m
1117,https://leetcode.com/problems/building-h2o,Building H2O,Medium,,7.0%,Concurrency,more_than_6m
1856,https://leetcode.com/problems/maximum-subarray-min-product,Maximum Subarray Min-Product,Medium,,7.0%,"Array, Stack, Monotonic Stack, Prefix Sum",more_than_6m
2879,https://leetcode.com/problems/display-the-first-three-rows,Display the First Three Rows,Easy,,7.0%,,more_than_6m
2940,https://leetcode.com/problems/find-building-where-alice-and-bob-can-meet,Find Building Where Alice and Bob Can Meet,Hard,,7.0%,"Array, Binary Search, Stack, Binary Indexed Tree, Segment Tree, Heap (Priority Queue), Monotonic Stack",more_than_6m
2566,https://leetcode.com/problems/maximum-difference-by-remapping-a-digit,Maximum Difference by Remapping a Digit,Easy,,7.0%,"Math, Greedy",more_than_6m
3309,https://leetcode.com/problems/maximum-possible-number-by-binary-concatenation,Maximum Possible Number by Binary Concatenation,Medium,,7.0%,"Array, Bit Manipulation, Enumeration",more_than_6m
2221,https://leetcode.com/problems/find-triangular-sum-of-an-array,Find Triangular Sum of an Array,Medium,,7.0%,"Array, Math, Simulation, Combinatorics, Number Theory",more_than_6m
3270,https://leetcode.com/problems/find-the-key-of-the-numbers,Find the Key of the Numbers,Easy,,7.0%,Math,more_than_6m
1712,https://leetcode.com/problems/ways-to-split-array-into-three-subarrays,Ways to Split Array Into Three Subarrays,Medium,,7.0%,"Array, Two Pointers, Binary Search, Prefix Sum",more_than_6m
1029,https://leetcode.com/problems/two-city-scheduling,Two City Scheduling,Medium,,7.0%,"Array, Greedy, Sorting",more_than_6m
2643,https://leetcode.com/problems/row-with-maximum-ones,Row With Maximum Ones,Easy,,7.0%,"Array, Matrix",more_than_6m
467,https://leetcode.com/problems/unique-substrings-in-wraparound-string,Unique Substrings in Wraparound String,Medium,,7.0%,"String, Dynamic Programming",more_than_6m
3066,https://leetcode.com/problems/minimum-operations-to-exceed-threshold-value-ii,Minimum Operations to Exceed Threshold Value II,Medium,,7.0%,"Array, Heap (Priority Queue), Simulation",more_than_6m
538,https://leetcode.com/problems/convert-bst-to-greater-tree,Convert BST to Greater Tree,Medium,,7.0%,"Tree, Depth-First Search, Binary Search Tree, Binary Tree",more_than_6m
842,https://leetcode.com/problems/split-array-into-fibonacci-sequence,Split Array into Fibonacci Sequence,Medium,,7.0%,"String, Backtracking",more_than_6m
3426,https://leetcode.com/problems/manhattan-distances-of-all-arrangements-of-pieces,Manhattan Distances of All Arrangements of Pieces,Hard,,7.0%,"Math, Combinatorics",more_than_6m
1156,https://leetcode.com/problems/swap-for-longest-repeated-character-substring,Swap For Longest Repeated Character Substring,Medium,,7.0%,"Hash Table, String, Sliding Window",more_than_6m
965,https://leetcode.com/problems/univalued-binary-tree,Univalued Binary Tree,Easy,,7.0%,"Tree, Depth-First Search, Breadth-First Search, Binary Tree",more_than_6m
2163,https://leetcode.com/problems/minimum-difference-in-sums-after-removal-of-elements,Minimum Difference in Sums After Removal of Elements,Hard,,7.0%,"Array, Dynamic Programming, Heap (Priority Queue)",more_than_6m
1035,https://leetcode.com/problems/uncrossed-lines,Uncrossed Lines,Medium,,7.0%,"Array, Dynamic Programming",more_than_6m
1773,https://leetcode.com/problems/count-items-matching-a-rule,Count Items Matching a Rule,Easy,,7.0%,"Array, String",more_than_6m
711,https://leetcode.com/problems/number-of-distinct-islands-ii,Number of Distinct Islands II,Hard,,7.0%,"Array, Hash Table, Depth-First Search, Breadth-First Search, Union-Find, Sorting, Matrix, Hash Function",more_than_6m
3271,https://leetcode.com/problems/hash-divided-string,Hash Divided String,Medium,,7.0%,"String, Simulation",more_than_6m
2262,https://leetcode.com/problems/total-appeal-of-a-string,Total Appeal of A String,Hard,,7.0%,"Hash Table, String, Dynamic Programming",more_than_6m
3363,https://leetcode.com/problems/find-the-maximum-number-of-fruits-collected,Find the Maximum Number of Fruits Collected,Hard,,7.0%,"Array, Dynamic Programming, Matrix",more_than_6m
2206,https://leetcode.com/problems/divide-array-into-equal-pairs,Divide Array Into Equal Pairs,Easy,,7.0%,"Array, Hash Table, Bit Manipulation, Counting",more_than_6m
461,https://leetcode.com/problems/hamming-distance,Hamming Distance,Easy,,7.0%,Bit Manipulation,more_than_6m
2375,https://leetcode.com/problems/construct-smallest-number-from-di-string,Construct Smallest Number From DI String,Medium,,7.0%,"String, Backtracking, Stack, Greedy",more_than_6m
2685,https://leetcode.com/problems/count-the-number-of-complete-components,Count the Number of Complete Components,Medium,,7.0%,"Depth-First Search, Breadth-First Search, Union-Find, Graph Theory",more_than_6m
195,https://leetcode.com/problems/tenth-line,Tenth Line,Easy,,7.0%,Shell,more_than_6m
3459,https://leetcode.com/problems/length-of-longest-v-shaped-diagonal-segment,Length of Longest V-Shaped Diagonal Segment,Hard,,7.0%,"Array, Dynamic Programming, Memoization, Matrix",more_than_6m
2615,https://leetcode.com/problems/sum-of-distances,Sum of Distances,Medium,,7.0%,"Array, Hash Table, Prefix Sum",more_than_6m
2579,https://leetcode.com/problems/count-total-number-of-colored-cells,Count Total Number of Colored Cells,Medium,,7.0%,Math,more_than_6m
1748,https://leetcode.com/problems/sum-of-unique-elements,Sum of Unique Elements,Easy,,7.0%,"Array, Hash Table, Counting",more_than_6m
2648,https://leetcode.com/problems/generate-fibonacci-sequence,Generate Fibonacci Sequence,Easy,,7.0%,,more_than_6m
1588,https://leetcode.com/problems/sum-of-all-odd-length-subarrays,Sum of All Odd Length Subarrays,Easy,,7.0%,"Array, Math, Prefix Sum",more_than_6m
2771,https://leetcode.com/problems/longest-non-decreasing-subarray-from-two-arrays,Longest Non-decreasing Subarray From Two Arrays,Medium,,7.0%,"Array, Dynamic Programming",more_than_6m
285,https://leetcode.com/problems/inorder-successor-in-bst,Inorder Successor in BST,Medium,,7.0%,"Tree, Depth-First Search, Binary Search Tree, Binary Tree",more_than_6m
2033,https://leetcode.com/problems/minimum-operations-to-make-a-uni-value-grid,Minimum Operations to Make a Uni-Value Grid,Medium,,7.0%,"Array, Math, Sorting, Matrix",more_than_6m
2294,https://leetcode.com/problems/partition-array-such-that-maximum-difference-is-k,Partition Array Such That Maximum Difference Is K,Medium,,7.0%,"Array, Greedy, Sorting",more_than_6m
2575,https://leetcode.com/problems/find-the-divisibility-array-of-a-string,Find the Divisibility Array of a String,Medium,,7.0%,"Array, Math, String",more_than_6m
848,https://leetcode.com/problems/shifting-letters,Shifting Letters,Medium,,7.0%,"Array, String, Prefix Sum",more_than_6m
3396,https://leetcode.com/problems/minimum-number-of-operations-to-make-elements-in-array-distinct,Minimum Number of Operations to Make Elements in Array Distinct,Easy,,7.0%,"Array, Hash Table",more_than_6m
2573,https://leetcode.com/problems/find-the-string-with-lcp,Find the String with LCP,Hard,,7.0%,"Array, String, Dynamic Programming, Greedy, Union-Find, Matrix",more_than_6m
2071,https://leetcode.com/problems/maximum-number-of-tasks-you-can-assign,Maximum Number of Tasks You Can Assign,Hard,,7.0%,"Array, Two Pointers, Binary Search, Greedy, Queue, Sorting, Monotonic Queue",more_than_6m
858,https://leetcode.com/problems/mirror-reflection,Mirror Reflection,Medium,,7.0%,"Math, Geometry, Number Theory",more_than_6m
3100,https://leetcode.com/problems/water-bottles-ii,Water Bottles II,Medium,,7.0%,"Math, Simulation",more_than_6m
2319,https://leetcode.com/problems/check-if-matrix-is-x-matrix,Check if Matrix Is X-Matrix,Easy,,7.0%,"Array, Matrix",more_than_6m
2138,https://leetcode.com/problems/divide-a-string-into-groups-of-size-k,Divide a String Into Groups of Size k,Easy,,7.0%,"String, Simulation",more_than_6m
1179,https://leetcode.com/problems/reformat-department-table,Reformat Department Table,Easy,,7.0%,Database,more_than_6m
3486,https://leetcode.com/problems/longest-special-path-ii,Longest Special Path II,Hard,,7.0%,"Array, Hash Table, Tree, Depth-First Search, Prefix Sum",more_than_6m
3523,https://leetcode.com/problems/make-array-non-decreasing,Make Array Non-decreasing,Medium,,7.0%,"Array, Stack, Greedy, Monotonic Stack",more_than_6m
1762,https://leetcode.com/problems/buildings-with-an-ocean-view,Buildings With an Ocean View,Medium,,7.0%,"Array, Stack, Monotonic Stack",more_than_6m
3335,https://leetcode.com/problems/total-characters-in-string-after-transformations-i,Total Characters in String After Transformations I,Medium,,7.0%,"Hash Table, Math, String, Dynamic Programming, Counting",more_than_6m
1690,https://leetcode.com/problems/stone-game-vii,Stone Game VII,Medium,,7.0%,"Array, Math, Dynamic Programming, Game Theory",more_than_6m
3541,https://leetcode.com/problems/find-most-frequent-vowel-and-consonant,Find Most Frequent Vowel and Consonant,Easy,,7.0%,"Hash Table, String, Counting",more_than_6m
1611,https://leetcode.com/problems/minimum-one-bit-operations-to-make-integers-zero,Minimum One Bit Operations to Make Integers Zero,Hard,,7.0%,"Math, Dynamic Programming, Bit Manipulation, Recursion, Memoization",more_than_6m
1374,https://leetcode.com/problems/generate-a-string-with-characters-that-have-odd-counts,Generate a String With Characters That Have Odd Counts,Easy,,7.0%,String,more_than_6m
566,https://leetcode.com/problems/reshape-the-matrix,Reshape the Matrix,Easy,,7.0%,"Array, Matrix, Simulation",more_than_6m
1250,https://leetcode.com/problems/check-if-it-is-a-good-array,Check If It Is a Good Array,Hard,,7.0%,"Array, Math, Number Theory",more_than_6m
2002,https://leetcode.com/problems/maximum-product-of-the-length-of-two-palindromic-subsequences,Maximum Product of the Length of Two Palindromic Subsequences,Medium,,7.0%,"String, Dynamic Programming, Backtracking, Bit Manipulation, Bitmask",more_than_6m
3536,https://leetcode.com/problems/maximum-product-of-two-digits,Maximum Product of Two Digits,Easy,,7.0%,"Math, Sorting",more_than_6m
736,https://leetcode.com/problems/parse-lisp-expression,Parse Lisp Expression,Hard,,7.0%,"Hash Table, String, Stack, Recursion",more_than_6m
1396,https://leetcode.com/problems/design-underground-system,Design Underground System,Medium,,7.0%,"Hash Table, String, Design",more_than_6m
3000,https://leetcode.com/problems/maximum-area-of-longest-diagonal-rectangle,Maximum Area of Longest Diagonal Rectangle,Easy,,7.0%,Array,more_than_6m
984,https://leetcode.com/problems/string-without-aaa-or-bbb,String Without AAA or BBB,Medium,,7.0%,"String, Greedy",more_than_6m
2359,https://leetcode.com/problems/find-closest-node-to-given-two-nodes,Find Closest Node to Given Two Nodes,Medium,,7.0%,"Depth-First Search, Graph Theory",more_than_6m
1298,https://leetcode.com/problems/maximum-candies-you-can-get-from-boxes,Maximum Candies You Can Get from Boxes,Hard,,7.0%,"Array, Breadth-First Search, Graph Theory",more_than_6m
1995,https://leetcode.com/problems/count-special-quadruplets,Count Special Quadruplets,Easy,,7.0%,"Array, Hash Table, Enumeration",more_than_6m
2211,https://leetcode.com/problems/count-collisions-on-a-road,Count Collisions on a Road,Medium,,7.0%,"String, Stack, Simulation",more_than_6m
3442,https://leetcode.com/problems/maximum-difference-between-even-and-odd-frequency-i,Maximum Difference Between Even and Odd Frequency I,Easy,,7.0%,"Hash Table, String, Counting",more_than_6m
3227,https://leetcode.com/problems/vowels-game-in-a-string,Vowels Game in a String,Medium,,7.0%,"Math, String, Brainteaser, Game Theory",more_than_6m
3483,https://leetcode.com/problems/unique-3-digit-even-numbers,Unique 3-Digit Even Numbers,Easy,,7.0%,"Array, Hash Table, Recursion, Enumeration",more_than_6m
1779,https://leetcode.com/problems/find-nearest-point-that-has-the-same-x-or-y-coordinate,Find Nearest Point That Has the Same X or Y Coordinate,Easy,,7.0%,Array,more_than_6m
244,https://leetcode.com/problems/shortest-word-distance-ii,Shortest Word Distance II,Medium,,7.0%,"Array, Hash Table, Two Pointers, String, Design",more_than_6m
2389,https://leetcode.com/problems/longest-subsequence-with-limited-sum,Longest Subsequence With Limited Sum,Easy,,7.0%,"Array, Binary Search, Greedy, Sorting, Prefix Sum",more_than_6m
1685,https://leetcode.com/problems/sum-of-absolute-differences-in-a-sorted-array,Sum of Absolute Differences in a Sorted Array,Medium,,7.0%,"Array, Math, Prefix Sum",more_than_6m
1402,https://leetcode.com/problems/reducing-dishes,Reducing Dishes,Hard,,7.0%,"Array, Dynamic Programming, Greedy, Sorting",more_than_6m
1478,https://leetcode.com/problems/allocate-mailboxes,Allocate Mailboxes,Hard,,7.0%,"Array, Math, Dynamic Programming, Sorting",more_than_6m
3606,https://leetcode.com/problems/coupon-code-validator,Coupon Code Validator,Easy,,7.0%,"Array, Hash Table, String, Sorting",more_than_6m
1339,https://leetcode.com/problems/maximum-product-of-splitted-binary-tree,Maximum Product of Splitted Binary Tree,Medium,,7.0%,"Tree, Depth-First Search, Binary Tree",more_than_6m
1458,https://leetcode.com/problems/max-dot-product-of-two-subsequences,Max Dot Product of Two Subsequences,Hard,,7.0%,"Array, Dynamic Programming",more_than_6m
2365,https://leetcode.com/problems/task-scheduler-ii,Task Scheduler II,Medium,,7.0%,"Array, Hash Table, Simulation",more_than_6m
714,https://leetcode.com/problems/best-time-to-buy-and-sell-stock-with-transaction-fee,Best Time to Buy and Sell Stock with Transaction Fee,Medium,,7.0%,"Array, Dynamic Programming, Greedy",more_than_6m
1928,https://leetcode.com/problems/minimum-cost-to-reach-destination-in-time,Minimum Cost to Reach Destination in Time,Hard,,7.0%,"Array, Dynamic Programming, Graph Theory",more_than_6m
3197,https://leetcode.com/problems/find-the-minimum-area-to-cover-all-ones-ii,Find the Minimum Area to Cover All Ones II,Hard,,7.0%,"Array, Matrix, Enumeration",more_than_6m
511,https://leetcode.com/problems/game-play-analysis-i,Game Play Analysis I,Easy,,7.0%,Database,more_than_6m
2637,https://leetcode.com/problems/promise-time-limit,Promise Time Limit,Medium,,7.0%,,more_than_6m
3630,https://leetcode.com/problems/partition-array-for-maximum-xor-and-and,Partition Array for Maximum XOR and AND,Hard,,7.0%,"Array, Math, Greedy, Bit Manipulation, Enumeration",more_than_6m
1466,https://leetcode.com/problems/reorder-routes-to-make-all-paths-lead-to-the-city-zero,Reorder Routes to Make All Paths Lead to the City Zero,Medium,,7.0%,"Depth-First Search, Breadth-First Search, Graph Theory",more_than_6m
2325,https://leetcode.com/problems/decode-the-message,Decode the Message,Easy,,7.0%,"Hash Table, String",more_than_6m
3640,https://leetcode.com/problems/trionic-array-ii,Trionic Array II,Hard,,7.0%,"Array, Dynamic Programming",more_than_6m
602,https://leetcode.com/problems/friend-requests-ii-who-has-the-most-friends,Friend Requests II: Who Has the Most Friends,Medium,,7.0%,Database,more_than_6m
1112,https://leetcode.com/problems/highest-grade-for-each-student,Highest Grade For Each Student,Medium,,7.0%,Database,more_than_6m
868,https://leetcode.com/problems/binary-gap,Binary Gap,Easy,,7.0%,Bit Manipulation,more_than_6m
3666,https://leetcode.com/problems/minimum-operations-to-equalize-binary-string,Minimum Operations to Equalize Binary String,Hard,,7.0%,"Math, String, Breadth-First Search, Union-Find, Ordered Set",more_than_6m
,https://leetcode.com/problems/find-all-possible-stable-binary-arrays-i,Find All Possible Stable Binary Arrays I,Medium,,7.0%,"Dynamic Programming, Prefix Sum",more_than_6m
3421,https://leetcode.com/problems/find-students-who-improved,Find Students Who Improved,Medium,,7.0%,Database,more_than_6m
3685,https://leetcode.com/problems/subsequence-sum-after-capping-elements,Subsequence Sum After Capping Elements,Medium,,7.0%,"Array, Two Pointers, Dynamic Programming, Sorting",more_than_6m
3484,https://leetcode.com/problems/design-spreadsheet,Design Spreadsheet,Medium,,7.0%,"Array, Hash Table, String, Design, Matrix",more_than_6m
1263,https://leetcode.com/problems/minimum-moves-to-move-a-box-to-their-target-location,Minimum Moves to Move a Box to Their Target Location,Hard,,7.0%,"Array, Breadth-First Search, Heap (Priority Queue), Matrix",more_than_6m
2974,https://leetcode.com/problems/minimum-number-game,Minimum Number Game,Easy,,7.0%,"Array, Sorting, Heap (Priority Queue), Simulation",more_than_6m
3006,https://leetcode.com/problems/find-beautiful-indices-in-the-given-array-i,Find Beautiful Indices in the Given Array I,Medium,,7.0%,"Two Pointers, String, Binary Search, Rolling Hash, String Matching, Hash Function",more_than_6m
1486,https://leetcode.com/problems/xor-operation-in-an-array,XOR Operation in an Array,Easy,,7.0%,"Math, Bit Manipulation",more_than_6m
3013,https://leetcode.com/problems/divide-an-array-into-subarrays-with-minimum-cost-ii,Divide an Array Into Subarrays With Minimum Cost II,Hard,,7.0%,"Array, Hash Table, Sliding Window, Heap (Priority Queue)",more_than_6m
3747,https://leetcode.com/problems/count-distinct-integers-after-removing-zeros,Count Distinct Integers After Removing Zeros,Medium,,7.0%,"Math, Dynamic Programming",more_than_6m
3583,https://leetcode.com/problems/count-special-triplets,Count Special Triplets,Medium,,7.0%,"Array, Hash Table, Counting",more_than_6m
3562,https://leetcode.com/problems/maximum-profit-from-trading-stocks-with-discounts,Maximum Profit from Trading Stocks with Discounts,Hard,,7.0%,"Array, Dynamic Programming, Tree, Depth-First Search",more_than_6m
608,https://leetcode.com/problems/tree-node,Tree Node,Medium,,5.0%,Database,more_than_6m
646,https://leetcode.com/problems/maximum-length-of-pair-chain,Maximum Length of Pair Chain,Medium,,5.0%,"Array, Dynamic Programming, Greedy, Sorting",more_than_6m
651,https://leetcode.com/problems/4-keys-keyboard,4 Keys Keyboard,Medium,,5.0%,"Math, Dynamic Programming",more_than_6m
691,https://leetcode.com/problems/stickers-to-spell-word,Stickers to Spell Word,Hard,,5.0%,"Array, Hash Table, String, Dynamic Programming, Backtracking, Bit Manipulation, Memoization, Bitmask",more_than_6m
806,https://leetcode.com/problems/number-of-lines-to-write-string,Number of Lines To Write String,Easy,,5.0%,"Array, String",more_than_6m
1087,https://leetcode.com/problems/brace-expansion,Brace Expansion,Medium,,5.0%,"String, Backtracking, Stack, Breadth-First Search, Sorting",more_than_6m
1168,https://leetcode.com/problems/optimize-water-distribution-in-a-village,Optimize Water Distribution in a Village,Hard,,5.0%,"Union-Find, Graph Theory, Heap (Priority Queue), Minimum Spanning Tree",more_than_6m
1147,https://leetcode.com/problems/longest-chunked-palindrome-decomposition,Longest Chunked Palindrome Decomposition,Hard,,5.0%,"Two Pointers, String, Dynamic Programming, Greedy, Rolling Hash, Hash Function",more_than_6m
1359,https://leetcode.com/problems/count-all-valid-pickup-and-delivery-options,Count All Valid Pickup and Delivery Options,Hard,,5.0%,"Math, Dynamic Programming, Combinatorics",more_than_6m
1377,https://leetcode.com/problems/frog-position-after-t-seconds,Frog Position After T Seconds,Hard,,5.0%,"Tree, Depth-First Search, Breadth-First Search, Graph Theory",more_than_6m
1401,https://leetcode.com/problems/circle-and-rectangle-overlapping,Circle and Rectangle Overlapping,Medium,,5.0%,"Math, Geometry",more_than_6m
1424,https://leetcode.com/problems/diagonal-traverse-ii,Diagonal Traverse II,Medium,,5.0%,"Array, Sorting, Heap (Priority Queue)",more_than_6m
1579,https://leetcode.com/problems/remove-max-number-of-edges-to-keep-graph-fully-traversable,Remove Max Number of Edges to Keep Graph Fully Traversable,Hard,,5.0%,"Union-Find, Graph Theory",more_than_6m
1824,https://leetcode.com/problems/minimum-sideway-jumps,Minimum Sideway Jumps,Medium,,5.0%,"Array, Dynamic Programming, Greedy",more_than_6m
1845,https://leetcode.com/problems/seat-reservation-manager,Seat Reservation Manager,Medium,,5.0%,"Design, Heap (Priority Queue)",more_than_6m
2271,https://leetcode.com/problems/maximum-white-tiles-covered-by-a-carpet,Maximum White Tiles Covered by a Carpet,Medium,,5.0%,"Array, Binary Search, Greedy, Sliding Window, Sorting, Prefix Sum",more_than_6m
2313,https://leetcode.com/problems/minimum-flips-in-binary-tree-to-get-result,Minimum Flips in Binary Tree to Get Result,Hard,,5.0%,"Dynamic Programming, Tree, Depth-First Search, Binary Tree",more_than_6m
2369,https://leetcode.com/problems/check-if-there-is-a-valid-partition-for-the-array,Check if There is a Valid Partition For The Array,Medium,,5.0%,"Array, Dynamic Programming",more_than_6m
2467,https://leetcode.com/problems/most-profitable-path-in-a-tree,Most Profitable Path in a Tree,Medium,,5.0%,"Array, Tree, Depth-First Search, Breadth-First Search, Graph Theory",more_than_6m
2540,https://leetcode.com/problems/minimum-common-value,Minimum Common Value,Easy,,5.0%,"Array, Hash Table, Two Pointers, Binary Search",more_than_6m
2158,https://leetcode.com/problems/amount-of-new-area-painted-each-day,Amount of New Area Painted Each Day,Hard,,5.0%,"Array, Segment Tree, Ordered Set",more_than_6m
2405,https://leetcode.com/problems/optimal-partition-of-string,Optimal Partition of String,Medium,,5.0%,"Hash Table, String, Greedy",more_than_6m
458,https://leetcode.com/problems/poor-pigs,Poor Pigs,Hard,,5.0%,"Math, Dynamic Programming, Combinatorics",more_than_6m
623,https://leetcode.com/problems/add-one-row-to-tree,Add One Row to Tree,Medium,,5.0%,"Tree, Depth-First Search, Breadth-First Search, Binary Tree",more_than_6m
953,https://leetcode.com/problems/verifying-an-alien-dictionary,Verifying an Alien Dictionary,Easy,,5.0%,"Array, Hash Table, String",more_than_6m
1171,https://leetcode.com/problems/remove-zero-sum-consecutive-nodes-from-linked-list,Remove Zero Sum Consecutive Nodes from Linked List,Medium,,5.0%,"Hash Table, Linked List",more_than_6m
1361,https://leetcode.com/problems/validate-binary-tree-nodes,Validate Binary Tree Nodes,Medium,,5.0%,"Tree, Depth-First Search, Breadth-First Search, Union-Find, Graph Theory, Binary Tree",more_than_6m
1237,https://leetcode.com/problems/find-positive-integer-solution-for-a-given-equation,Find Positive Integer Solution for a Given Equation,Medium,,5.0%,"Math, Two Pointers, Binary Search, Interactive",more_than_6m
