ID,URL,Title,Difficulty,Acceptance %,Frequency %,Topics,Timeframe
1,https://leetcode.com/problems/two-sum,Two Sum,Easy,,100.0%,"Array, Hash Table",30_days
42,https://leetcode.com/problems/trapping-rain-water,Trapping Rain Water,Hard,,72.7%,"Array, Two Pointers, Dynamic Programming, Stack, Monotonic Stack",30_days
121,https://leetcode.com/problems/best-time-to-buy-and-sell-stock,Best Time to Buy and Sell Stock,Easy,,68.2%,"Array, Dynamic Programming",30_days
9,https://leetcode.com/problems/palindrome-number,Palindrome Number,Easy,,66.4%,Math,30_days
15,https://leetcode.com/problems/3sum,3Sum,Medium,,66.4%,"Array, Two Pointers, Sorting",30_days
7,https://leetcode.com/problems/reverse-integer,Reverse Integer,Medium,,66.4%,Math,30_days
2,https://leetcode.com/problems/add-two-numbers,Add Two Numbers,Medium,,64.4%,"Linked List, Math, Recursion",30_days
1929,https://leetcode.com/problems/concatenation-of-array,Concatenation of Array,Easy,,64.4%,"Array, Simulation",30_days
4,https://leetcode.com/problems/median-of-two-sorted-arrays,Median of Two Sorted Arrays,Hard,,62.3%,"Array, Binary Search, Divide and Conquer",30_days
53,https://leetcode.com/problems/maximum-subarray,Maximum Subarray,Medium,,62.3%,"Array, Divide and Conquer, Dynamic Programming",30_days
5,https://leetcode.com/problems/longest-palindromic-substring,Longest Palindromic Substring,Medium,,59.9%,"Two Pointers, String, Dynamic Programming",30_days
20,https://leetcode.com/problems/valid-parentheses,Valid Parentheses,Easy,,59.9%,"String, Stack",30_days
3,https://leetcode.com/problems/longest-substring-without-repeating-characters,Longest Substring Without Repeating Characters,Medium,,57.2%,"Hash Table, String, Sliding Window",30_days
13,https://leetcode.com/problems/roman-to-integer,Roman to Integer,Easy,,54.0%,"Hash Table, Math, String",30_days
128,https://leetcode.com/problems/longest-consecutive-sequence,Longest Consecutive Sequence,Medium,,54.0%,"Array, Hash Table, Union-Find",30_days
26,https://leetcode.com/problems/remove-duplicates-from-sorted-array,Remove Duplicates from Sorted Array,Easy,,54.0%,"Array, Two Pointers",30_days
21,https://leetcode.com/problems/merge-two-sorted-lists,Merge Two Sorted Lists,Easy,,54.0%,"Linked List, Recursion",30_days
169,https://leetcode.com/problems/majority-element,Majority Element,Easy,,54.0%,"Array, Hash Table, Divide and Conquer, Sorting, Counting",30_days
51,https://leetcode.com/problems/n-queens,N-Queens,Hard,,54.0%,"Array, Backtracking",30_days
50,https://leetcode.com/problems/powx-n,"Pow(x, n)",Medium,,54.0%,"Math, Recursion",30_days
54,https://leetcode.com/problems/spiral-matrix,Spiral Matrix,Medium,,50.3%,"Array, Matrix, Simulation",30_days
410,https://leetcode.com/problems/split-array-largest-sum,Split Array Largest Sum,Hard,,50.3%,"Array, Binary Search, Dynamic Programming, Greedy, Prefix Sum",30_days
49,https://leetcode.com/problems/group-anagrams,Group Anagrams,Medium,,50.3%,"Array, Hash Table, String, Sorting",30_days
11,https://leetcode.com/problems/container-with-most-water,Container With Most Water,Medium,,50.3%,"Array, Two Pointers, Greedy",30_days
69,https://leetcode.com/problems/sqrtx,Sqrt(x),Easy,,50.3%,"Math, Binary Search",30_days
189,https://leetcode.com/problems/rotate-array,Rotate Array,Medium,,50.3%,"Array, Math, Two Pointers",30_days
,https://leetcode.com/problems/number-of-zigzag-arrays-i,Number of ZigZag Arrays I,Hard,,50.3%,"Dynamic Programming, Prefix Sum",30_days
88,https://leetcode.com/problems/merge-sorted-array,Merge Sorted Array,Easy,,45.8%,"Array, Two Pointers, Sorting",30_days
2667,https://leetcode.com/problems/create-hello-world-function,Create Hello World Function,Easy,,45.8%,,30_days
33,https://leetcode.com/problems/search-in-rotated-sorted-array,Search in Rotated Sorted Array,Medium,,45.8%,"Array, Binary Search",30_days
359,https://leetcode.com/problems/logger-rate-limiter,Logger Rate Limiter,Easy,,45.8%,"Hash Table, Design, Data Stream",30_days
14,https://leetcode.com/problems/longest-common-prefix,Longest Common Prefix,Easy,,45.8%,"Array, String, Trie",30_days
300,https://leetcode.com/problems/longest-increasing-subsequence,Longest Increasing Subsequence,Medium,,45.8%,"Array, Binary Search, Dynamic Programming",30_days
48,https://leetcode.com/problems/rotate-image,Rotate Image,Medium,,45.8%,"Array, Math, Matrix",30_days
3161,https://leetcode.com/problems/block-placement-queries,Block Placement Queries,Hard,,45.8%,"Array, Binary Search, Binary Indexed Tree, Segment Tree, Ordered Set",30_days
322,https://leetcode.com/problems/coin-change,Coin Change,Medium,,45.8%,"Array, Dynamic Programming, Breadth-First Search",30_days
102,https://leetcode.com/problems/binary-tree-level-order-traversal,Binary Tree Level Order Traversal,Medium,,45.8%,"Tree, Breadth-First Search, Binary Tree",30_days
,https://leetcode.com/problems/earliest-finish-time-for-land-and-water-rides-ii,Earliest Finish Time for Land and Water Rides II,Medium,,45.8%,"Array, Two Pointers, Binary Search, Greedy, Sorting",30_days
200,https://leetcode.com/problems/number-of-islands,Number of Islands,Medium,,45.8%,"Array, Depth-First Search, Breadth-First Search, Union-Find, Matrix",30_days
81,https://leetcode.com/problems/search-in-rotated-sorted-array-ii,Search in Rotated Sorted Array II,Medium,,45.8%,"Array, Binary Search",30_days
84,https://leetcode.com/problems/largest-rectangle-in-histogram,Largest Rectangle in Histogram,Hard,,45.8%,"Array, Stack, Monotonic Stack",30_days
70,https://leetcode.com/problems/climbing-stairs,Climbing Stairs,Easy,,45.8%,"Math, Dynamic Programming, Memoization",30_days
268,https://leetcode.com/problems/missing-number,Missing Number,Easy,,45.8%,"Array, Hash Table, Math, Binary Search, Bit Manipulation, Sorting",30_days
176,https://leetcode.com/problems/second-highest-salary,Second Highest Salary,Medium,,45.8%,Database,30_days
41,https://leetcode.com/problems/first-missing-positive,First Missing Positive,Hard,,45.8%,"Array, Hash Table",30_days
1344,https://leetcode.com/problems/angle-between-hands-of-a-clock,Angle Between Hands of a Clock,Medium,,45.8%,Math,30_days
1732,https://leetcode.com/problems/find-the-highest-altitude,Find the Highest Altitude,Easy,,45.8%,"Array, Prefix Sum",30_days
1757,https://leetcode.com/problems/recyclable-and-low-fat-products,Recyclable and Low Fat Products,Easy,,40.0%,Database,30_days
204,https://leetcode.com/problems/count-primes,Count Primes,Medium,,40.0%,"Array, Math, Enumeration, Number Theory",30_days
344,https://leetcode.com/problems/reverse-string,Reverse String,Easy,,40.0%,"Two Pointers, String",30_days
1768,https://leetcode.com/problems/merge-strings-alternately,Merge Strings Alternately,Easy,,40.0%,"Two Pointers, String",30_days
146,https://leetcode.com/problems/lru-cache,LRU Cache,Medium,,40.0%,"Hash Table, Linked List, Design, Doubly-Linked List",30_days
345,https://leetcode.com/problems/reverse-vowels-of-a-string,Reverse Vowels of a String,Easy,,40.0%,"Two Pointers, String",30_days
55,https://leetcode.com/problems/jump-game,Jump Game,Medium,,40.0%,"Array, Dynamic Programming, Greedy",30_days
242,https://leetcode.com/problems/valid-anagram,Valid Anagram,Easy,,40.0%,"Hash Table, String, Sorting",30_days
3043,https://leetcode.com/problems/find-the-length-of-the-longest-common-prefix,Find the Length of the Longest Common Prefix,Medium,,40.0%,"Array, Hash Table, String, Trie",30_days
560,https://leetcode.com/problems/subarray-sum-equals-k,Subarray Sum Equals K,Medium,,40.0%,"Array, Hash Table, Prefix Sum",30_days
704,https://leetcode.com/problems/binary-search,Binary Search,Easy,,40.0%,"Array, Binary Search",30_days
416,https://leetcode.com/problems/partition-equal-subset-sum,Partition Equal Subset Sum,Medium,,40.0%,"Array, Dynamic Programming",30_days
8,https://leetcode.com/problems/string-to-integer-atoi,String to Integer (atoi),Medium,,40.0%,String,30_days
3121,https://leetcode.com/problems/count-the-number-of-special-characters-ii,Count the Number of Special Characters II,Medium,,40.0%,"Hash Table, String",30_days
22,https://leetcode.com/problems/generate-parentheses,Generate Parentheses,Medium,,40.0%,"String, Dynamic Programming, Backtracking",30_days
,https://leetcode.com/problems/minimum-element-after-replacement-with-digit-sum,Minimum Element After Replacement With Digit Sum,Easy,,40.0%,"Array, Math",30_days
733,https://leetcode.com/problems/flood-fill,Flood Fill,Easy,,40.0%,"Array, Depth-First Search, Breadth-First Search, Matrix",30_days
424,https://leetcode.com/problems/longest-repeating-character-replacement,Longest Repeating Character Replacement,Medium,,40.0%,"Hash Table, String, Sliding Window",30_days
75,https://leetcode.com/problems/sort-colors,Sort Colors,Medium,,40.0%,"Array, Two Pointers, Sorting",30_days
151,https://leetcode.com/problems/reverse-words-in-a-string,Reverse Words in a String,Medium,,40.0%,"Two Pointers, String",30_days
1470,https://leetcode.com/problems/shuffle-the-array,Shuffle the Array,Easy,,40.0%,Array,30_days
912,https://leetcode.com/problems/sort-an-array,Sort an Array,Medium,,40.0%,"Array, Divide and Conquer, Sorting, Heap (Priority Queue), Merge Sort, Bucket Sort, Radix Sort, Counting Sort",30_days
,https://leetcode.com/problems/earliest-finish-time-for-land-and-water-rides-i,Earliest Finish Time for Land and Water Rides I,Easy,,40.0%,"Array, Two Pointers, Binary Search, Greedy, Sorting",30_days
208,https://leetcode.com/problems/implement-trie-prefix-tree,Implement Trie (Prefix Tree),Medium,,40.0%,"Hash Table, String, Design, Trie",30_days
18,https://leetcode.com/problems/4sum,4Sum,Medium,,40.0%,"Array, Two Pointers, Sorting",30_days
152,https://leetcode.com/problems/maximum-product-subarray,Maximum Product Subarray,Medium,,40.0%,"Array, Dynamic Programming",30_days
62,https://leetcode.com/problems/unique-paths,Unique Paths,Medium,,40.0%,"Math, Dynamic Programming, Combinatorics",30_days
2574,https://leetcode.com/problems/left-and-right-sum-differences,Left and Right Sum Differences,Easy,,40.0%,"Array, Prefix Sum",30_days
17,https://leetcode.com/problems/letter-combinations-of-a-phone-number,Letter Combinations of a Phone Number,Medium,,40.0%,"Hash Table, String, Backtracking",30_days
181,https://leetcode.com/problems/employees-earning-more-than-their-managers,Employees Earning More Than Their Managers,Easy,,40.0%,Database,30_days
509,https://leetcode.com/problems/fibonacci-number,Fibonacci Number,Easy,,40.0%,"Math, Dynamic Programming, Recursion, Memoization",30_days
503,https://leetcode.com/problems/next-greater-element-ii,Next Greater Element II,Medium,,40.0%,"Array, Stack, Monotonic Stack",30_days
155,https://leetcode.com/problems/min-stack,Min Stack,Medium,,40.0%,"Stack, Design",30_days
,https://leetcode.com/problems/number-of-ways-to-assign-edge-weights-ii,Number of Ways to Assign Edge Weights II,Hard,,40.0%,"Array, Math, Dynamic Programming, Bit Manipulation, Tree, Depth-First Search",30_days
1502,https://leetcode.com/problems/can-make-arithmetic-progression-from-sequence,Can Make Arithmetic Progression From Sequence,Easy,,40.0%,"Array, Sorting",30_days
76,https://leetcode.com/problems/minimum-window-substring,Minimum Window Substring,Hard,,40.0%,"Hash Table, String, Sliding Window",30_days
904,https://leetcode.com/problems/fruit-into-baskets,Fruit Into Baskets,Medium,,40.0%,"Array, Hash Table, Sliding Window",30_days
101,https://leetcode.com/problems/symmetric-tree,Symmetric Tree,Easy,,40.0%,"Tree, Depth-First Search, Breadth-First Search, Binary Tree",30_days
287,https://leetcode.com/problems/find-the-duplicate-number,Find the Duplicate Number,Medium,,40.0%,"Array, Two Pointers, Binary Search, Bit Manipulation",30_days
875,https://leetcode.com/problems/koko-eating-bananas,Koko Eating Bananas,Medium,,40.0%,"Array, Binary Search",30_days
94,https://leetcode.com/problems/binary-tree-inorder-traversal,Binary Tree Inorder Traversal,Easy,,40.0%,"Stack, Tree, Depth-First Search, Binary Tree",30_days
206,https://leetcode.com/problems/reverse-linked-list,Reverse Linked List,Easy,,40.0%,"Linked List, Recursion",30_days
295,https://leetcode.com/problems/find-median-from-data-stream,Find Median from Data Stream,Hard,,32.0%,"Two Pointers, Design, Sorting, Heap (Priority Queue), Data Stream",30_days
253,https://leetcode.com/problems/meeting-rooms-ii,Meeting Rooms II,Medium,,32.0%,"Array, Two Pointers, Greedy, Sorting, Heap (Priority Queue), Prefix Sum",30_days
100,https://leetcode.com/problems/same-tree,Same Tree,Easy,,32.0%,"Tree, Depth-First Search, Breadth-First Search, Binary Tree",30_days
125,https://leetcode.com/problems/valid-palindrome,Valid Palindrome,Easy,,32.0%,"Two Pointers, String",30_days
349,https://leetcode.com/problems/intersection-of-two-arrays,Intersection of Two Arrays,Easy,,32.0%,"Array, Hash Table, Two Pointers, Binary Search, Sorting",30_days
103,https://leetcode.com/problems/binary-tree-zigzag-level-order-traversal,Binary Tree Zigzag Level Order Traversal,Medium,,32.0%,"Tree, Breadth-First Search, Binary Tree",30_days
743,https://leetcode.com/problems/network-delay-time,Network Delay Time,Medium,,32.0%,"Depth-First Search, Breadth-First Search, Graph Theory, Heap (Priority Queue), Shortest Path",30_days
713,https://leetcode.com/problems/subarray-product-less-than-k,Subarray Product Less Than K,Medium,,32.0%,"Array, Binary Search, Sliding Window, Prefix Sum",30_days
,https://leetcode.com/problems/total-waviness-of-numbers-in-range-ii,Total Waviness of Numbers in Range II,Hard,,32.0%,"Math, Dynamic Programming",30_days
35,https://leetcode.com/problems/search-insert-position,Search Insert Position,Easy,,32.0%,"Array, Binary Search",30_days
380,https://leetcode.com/problems/insert-delete-getrandom-o1,Insert Delete GetRandom O(1),Medium,,32.0%,"Array, Hash Table, Math, Design, Randomized",30_days
240,https://leetcode.com/problems/search-a-2d-matrix-ii,Search a 2D Matrix II,Medium,,32.0%,"Array, Binary Search, Divide and Conquer, Matrix",30_days
2196,https://leetcode.com/problems/create-binary-tree-from-descriptions,Create Binary Tree From Descriptions,Medium,,32.0%,"Array, Hash Table, Tree, Binary Tree",30_days
92,https://leetcode.com/problems/reverse-linked-list-ii,Reverse Linked List II,Medium,,32.0%,Linked List,30_days
2089,https://leetcode.com/problems/find-target-indices-after-sorting-array,Find Target Indices After Sorting Array,Easy,,32.0%,"Array, Binary Search, Sorting",30_days
2337,https://leetcode.com/problems/move-pieces-to-obtain-a-string,Move Pieces to Obtain a String,Medium,,32.0%,"Two Pointers, String",30_days
,https://leetcode.com/problems/maximum-total-subarray-value-i,Maximum Total Subarray Value I,Medium,,32.0%,"Array, Greedy",30_days
10,https://leetcode.com/problems/regular-expression-matching,Regular Expression Matching,Hard,,32.0%,"String, Dynamic Programming, Recursion",30_days
24,https://leetcode.com/problems/swap-nodes-in-pairs,Swap Nodes in Pairs,Medium,,32.0%,"Linked List, Recursion",30_days
66,https://leetcode.com/problems/plus-one,Plus One,Easy,,32.0%,"Array, Math",30_days
130,https://leetcode.com/problems/surrounded-regions,Surrounded Regions,Medium,,32.0%,"Array, Depth-First Search, Breadth-First Search, Union-Find, Matrix",30_days
199,https://leetcode.com/problems/binary-tree-right-side-view,Binary Tree Right Side View,Medium,,32.0%,"Tree, Depth-First Search, Breadth-First Search, Binary Tree",30_days
328,https://leetcode.com/problems/odd-even-linked-list,Odd Even Linked List,Medium,,32.0%,Linked List,30_days
239,https://leetcode.com/problems/sliding-window-maximum,Sliding Window Maximum,Hard,,32.0%,"Array, Queue, Sliding Window, Heap (Priority Queue), Monotonic Queue",30_days
124,https://leetcode.com/problems/binary-tree-maximum-path-sum,Binary Tree Maximum Path Sum,Hard,,32.0%,"Dynamic Programming, Tree, Depth-First Search, Binary Tree",30_days
584,https://leetcode.com/problems/find-customer-referee,Find Customer Referee,Easy,,32.0%,Database,30_days
387,https://leetcode.com/problems/first-unique-character-in-a-string,First Unique Character in a String,Easy,,32.0%,"Hash Table, String, Queue, Counting",30_days
,https://leetcode.com/problems/maximum-total-subarray-value-ii,Maximum Total Subarray Value II,Hard,,32.0%,"Array, Greedy, Segment Tree, Heap (Priority Queue)",30_days
179,https://leetcode.com/problems/largest-number,Largest Number,Medium,,32.0%,"Array, String, Greedy, Sorting",30_days
918,https://leetcode.com/problems/maximum-sum-circular-subarray,Maximum Sum Circular Subarray,Medium,,32.0%,"Array, Divide and Conquer, Dynamic Programming, Queue, Monotonic Queue",30_days
1378,https://leetcode.com/problems/replace-employee-id-with-the-unique-identifier,Replace Employee ID With The Unique Identifier,Easy,,32.0%,Database,30_days
1049,https://leetcode.com/problems/last-stone-weight-ii,Last Stone Weight II,Medium,,32.0%,"Array, Dynamic Programming",30_days
1295,https://leetcode.com/problems/find-numbers-with-even-number-of-digits,Find Numbers with Even Number of Digits,Easy,,32.0%,"Array, Math",30_days
191,https://leetcode.com/problems/number-of-1-bits,Number of 1 Bits,Easy,,32.0%,"Divide and Conquer, Bit Manipulation",30_days
547,https://leetcode.com/problems/number-of-provinces,Number of Provinces,Medium,,32.0%,"Depth-First Search, Breadth-First Search, Union-Find, Graph Theory",30_days
122,https://leetcode.com/problems/best-time-to-buy-and-sell-stock-ii,Best Time to Buy and Sell Stock II,Medium,,32.0%,"Array, Dynamic Programming, Greedy",30_days
136,https://leetcode.com/problems/single-number,Single Number,Easy,,32.0%,"Array, Bit Manipulation",30_days
2095,https://leetcode.com/problems/delete-the-middle-node-of-a-linked-list,Delete the Middle Node of a Linked List,Medium,,32.0%,"Linked List, Two Pointers",30_days
80,https://leetcode.com/problems/remove-duplicates-from-sorted-array-ii,Remove Duplicates from Sorted Array II,Medium,,32.0%,"Array, Two Pointers",30_days
304,https://leetcode.com/problems/range-sum-query-2d-immutable,Range Sum Query 2D - Immutable,Medium,,32.0%,"Array, Design, Matrix, Prefix Sum",30_days
567,https://leetcode.com/problems/permutation-in-string,Permutation in String,Medium,,32.0%,"Hash Table, Two Pointers, String, Sliding Window",30_days
1160,https://leetcode.com/problems/find-words-that-can-be-formed-by-characters,Find Words That Can Be Formed by Characters,Easy,,32.0%,"Array, Hash Table, String, Counting",30_days
27,https://leetcode.com/problems/remove-element,Remove Element,Easy,,32.0%,"Array, Two Pointers",30_days
383,https://leetcode.com/problems/ransom-note,Ransom Note,Easy,,32.0%,"Hash Table, String, Counting",30_days
739,https://leetcode.com/problems/daily-temperatures,Daily Temperatures,Medium,,32.0%,"Array, Stack, Monotonic Stack",30_days
16,https://leetcode.com/problems/3sum-closest,3Sum Closest,Medium,,32.0%,"Array, Two Pointers, Sorting",30_days
90,https://leetcode.com/problems/subsets-ii,Subsets II,Medium,,32.0%,"Array, Backtracking, Bit Manipulation",30_days
511,https://leetcode.com/problems/game-play-analysis-i,Game Play Analysis I,Easy,,32.0%,Database,30_days
148,https://leetcode.com/problems/sort-list,Sort List,Medium,,32.0%,"Linked List, Two Pointers, Divide and Conquer, Sorting, Merge Sort",30_days
175,https://leetcode.com/problems/combine-two-tables,Combine Two Tables,Easy,,32.0%,Database,30_days
493,https://leetcode.com/problems/reverse-pairs,Reverse Pairs,Hard,,32.0%,"Array, Binary Search, Divide and Conquer, Binary Indexed Tree, Segment Tree, Merge Sort, Ordered Set",30_days
143,https://leetcode.com/problems/reorder-list,Reorder List,Medium,,32.0%,"Linked List, Two Pointers, Stack, Recursion",30_days
415,https://leetcode.com/problems/add-strings,Add Strings,Easy,,32.0%,"Math, String, Simulation",30_days
643,https://leetcode.com/problems/maximum-average-subarray-i,Maximum Average Subarray I,Easy,,32.0%,"Array, Sliding Window",30_days
229,https://leetcode.com/problems/majority-element-ii,Majority Element II,Medium,,32.0%,"Array, Hash Table, Sorting, Counting",30_days
19,https://leetcode.com/problems/remove-nth-node-from-end-of-list,Remove Nth Node From End of List,Medium,,32.0%,"Linked List, Two Pointers",30_days
437,https://leetcode.com/problems/path-sum-iii,Path Sum III,Medium,,32.0%,"Tree, Depth-First Search, Binary Tree",30_days
,https://leetcode.com/problems/subarrays-distinct-element-sum-of-squares-i,Subarrays Distinct Element Sum of Squares I,Easy,,32.0%,"Array, Hash Table, Segment Tree",30_days
412,https://leetcode.com/problems/fizz-buzz,Fizz Buzz,Easy,,32.0%,"Math, String, Simulation",30_days
417,https://leetcode.com/problems/pacific-atlantic-water-flow,Pacific Atlantic Water Flow,Medium,,32.0%,"Array, Depth-First Search, Breadth-First Search, Matrix",30_days
67,https://leetcode.com/problems/add-binary,Add Binary,Easy,,32.0%,"Math, String, Bit Manipulation, Simulation",30_days
1193,https://leetcode.com/problems/monthly-transactions-i,Monthly Transactions I,Medium,,32.0%,Database,30_days
73,https://leetcode.com/problems/set-matrix-zeroes,Set Matrix Zeroes,Medium,,32.0%,"Array, Hash Table, Matrix",30_days
219,https://leetcode.com/problems/contains-duplicate-ii,Contains Duplicate II,Easy,,32.0%,"Array, Hash Table, Sliding Window",30_days
126,https://leetcode.com/problems/word-ladder-ii,Word Ladder II,Hard,,32.0%,"Hash Table, String, Backtracking, Breadth-First Search",30_days
205,https://leetcode.com/problems/isomorphic-strings,Isomorphic Strings,Easy,,32.0%,"Hash Table, String",30_days
312,https://leetcode.com/problems/burst-balloons,Burst Balloons,Hard,,32.0%,"Array, Dynamic Programming",30_days
153,https://leetcode.com/problems/find-minimum-in-rotated-sorted-array,Find Minimum in Rotated Sorted Array,Medium,,32.0%,"Array, Binary Search",30_days
605,https://leetcode.com/problems/can-place-flowers,Can Place Flowers,Easy,,32.0%,"Array, Greedy",30_days
225,https://leetcode.com/problems/implement-stack-using-queues,Implement Stack using Queues,Easy,,32.0%,"Stack, Design, Queue",30_days
132,https://leetcode.com/problems/palindrome-partitioning-ii,Palindrome Partitioning II,Hard,,32.0%,"String, Dynamic Programming",30_days
1189,https://leetcode.com/problems/maximum-number-of-balloons,Maximum Number of Balloons,Easy,,32.0%,"Hash Table, String, Counting",30_days
215,https://leetcode.com/problems/kth-largest-element-in-an-array,Kth Largest Element in an Array,Medium,,32.0%,"Array, Divide and Conquer, Sorting, Heap (Priority Queue), Quickselect",30_days
58,https://leetcode.com/problems/length-of-last-word,Length of Last Word,Easy,,32.0%,String,30_days
1589,https://leetcode.com/problems/maximum-sum-obtained-of-any-permutation,Maximum Sum Obtained of Any Permutation,Medium,,32.0%,"Array, Greedy, Sorting, Prefix Sum",30_days
1341,https://leetcode.com/problems/movie-rating,Movie Rating,Medium,,32.0%,Database,30_days
1907,https://leetcode.com/problems/count-salary-categories,Count Salary Categories,Medium,,32.0%,Database,30_days
443,https://leetcode.com/problems/string-compression,String Compression,Medium,,32.0%,"Two Pointers, String",30_days
1480,https://leetcode.com/problems/running-sum-of-1d-array,Running Sum of 1d Array,Easy,,32.0%,"Array, Prefix Sum",30_days
452,https://leetcode.com/problems/minimum-number-of-arrows-to-burst-balloons,Minimum Number of Arrows to Burst Balloons,Medium,,32.0%,"Array, Greedy, Sorting",30_days
217,https://leetcode.com/problems/contains-duplicate,Contains Duplicate,Easy,,32.0%,"Array, Hash Table, Sorting",30_days
,https://leetcode.com/problems/number-of-zigzag-arrays-ii,Number of ZigZag Arrays II,Hard,,32.0%,"Math, Dynamic Programming",30_days
543,https://leetcode.com/problems/diameter-of-binary-tree,Diameter of Binary Tree,Easy,,32.0%,"Tree, Depth-First Search, Binary Tree",30_days
1,https://leetcode.com/problems/two-sum,Two Sum,Easy,,100.0%,"Array, Hash Table",3_months
9,https://leetcode.com/problems/palindrome-number,Palindrome Number,Easy,,70.1%,Math,3_months
15,https://leetcode.com/problems/3sum,3Sum,Medium,,68.9%,"Array, Two Pointers, Sorting",3_months
121,https://leetcode.com/problems/best-time-to-buy-and-sell-stock,Best Time to Buy and Sell Stock,Easy,,68.9%,"Array, Dynamic Programming",3_months
1929,https://leetcode.com/problems/concatenation-of-array,Concatenation of Array,Easy,,68.9%,"Array, Simulation",3_months
42,https://leetcode.com/problems/trapping-rain-water,Trapping Rain Water,Hard,,66.3%,"Array, Two Pointers, Dynamic Programming, Stack, Monotonic Stack",3_months
2,https://leetcode.com/problems/add-two-numbers,Add Two Numbers,Medium,,66.3%,"Linked List, Math, Recursion",3_months
4,https://leetcode.com/problems/median-of-two-sorted-arrays,Median of Two Sorted Arrays,Hard,,64.8%,"Array, Binary Search, Divide and Conquer",3_months
5,https://leetcode.com/problems/longest-palindromic-substring,Longest Palindromic Substring,Medium,,64.8%,"Two Pointers, String, Dynamic Programming",3_months
14,https://leetcode.com/problems/longest-common-prefix,Longest Common Prefix,Easy,,62.3%,"Array, String, Trie",3_months
88,https://leetcode.com/problems/merge-sorted-array,Merge Sorted Array,Easy,,62.3%,"Array, Two Pointers, Sorting",3_months
3,https://leetcode.com/problems/longest-substring-without-repeating-characters,Longest Substring Without Repeating Characters,Medium,,61.4%,"Hash Table, String, Sliding Window",3_months
13,https://leetcode.com/problems/roman-to-integer,Roman to Integer,Easy,,60.5%,"Hash Table, Math, String",3_months
26,https://leetcode.com/problems/remove-duplicates-from-sorted-array,Remove Duplicates from Sorted Array,Easy,,60.5%,"Array, Two Pointers",3_months
128,https://leetcode.com/problems/longest-consecutive-sequence,Longest Consecutive Sequence,Medium,,60.5%,"Array, Hash Table, Union-Find",3_months
7,https://leetcode.com/problems/reverse-integer,Reverse Integer,Medium,,59.5%,Math,3_months
56,https://leetcode.com/problems/merge-intervals,Merge Intervals,Medium,,58.4%,"Array, Sorting",3_months
