ID,URL,Title,Difficulty,Acceptance %,Frequency %,Topics,Timeframe
200,https://leetcode.com/problems/number-of-islands,Number of Islands,Medium,,100.0%,"Array, Depth-First Search, Breadth-First Search, Union Find, Matrix",more_than_6m
927,https://leetcode.com/problems/three-equal-parts,Three Equal Parts,Hard,,100.0%,"Array, Math",more_than_6m
927,https://leetcode.com/problems/three-equal-parts,Three Equal Parts,Hard,,100.0%,"Array, Math",all
200,https://leetcode.com/problems/number-of-islands,Number of Islands,Medium,,66.6%,"Array, Depth-First Search, Breadth-First Search, Union Find, Matrix",all
124,https://leetcode.com/problems/binary-tree-maximum-path-sum,Binary Tree Maximum Path Sum,Hard,,66.6%,"Dynamic Programming, Tree, Depth-First Search, Binary Tree",all
