ID,URL,Title,Difficulty,Acceptance %,Frequency %,Topics,Timeframe
1249,https://leetcode.com/problems/minimum-remove-to-make-valid-parentheses,Minimum Remove to Make Valid Parentheses,Medium,,100.0%,"String, Stack",30_days
408,https://leetcode.com/problems/valid-word-abbreviation,Valid Word Abbreviation,Easy,,95.4%,"Two Pointers, String",30_days
314,https://leetcode.com/problems/binary-tree-vertical-order-traversal,Binary Tree Vertical Order Traversal,Medium,,93.4%,"Hash Table, Tree, Depth-First Search, Breadth-First Search, Sorting, Binary Tree",30_days
680,https://leetcode.com/problems/valid-palindrome-ii,Valid Palindrome II,Easy,,92.7%,"Two Pointers, String, Greedy",30_days
1650,https://leetcode.com/problems/lowest-common-ancestor-of-a-binary-tree-iii,Lowest Common Ancestor of a Binary Tree III,Medium,,89.6%,"Hash Table, Two Pointers, Tree, Binary Tree",30_days
215,https://leetcode.com/problems/kth-largest-element-in-an-array,Kth Largest Element in an Array,Medium,,86.9%,"Array, Divide and Conquer, Sorting, Heap (Priority Queue), Quickselect",30_days
199,https://leetcode.com/problems/binary-tree-right-side-view,Binary Tree Right Side View,Medium,,86.0%,"Tree, Depth-First Search, Breadth-First Search, Binary Tree",30_days
227,https://leetcode.com/problems/basic-calculator-ii,Basic Calculator II,Medium,,84.0%,"Math, String, Stack",30_days
236,https://leetcode.com/problems/lowest-common-ancestor-of-a-binary-tree,Lowest Common Ancestor of a Binary Tree,Medium,,82.9%,"Tree, Depth-First Search, Binary Tree",30_days
162,https://leetcode.com/problems/find-peak-element,Find Peak Element,Medium,,82.9%,"Array, Binary Search",30_days
339,https://leetcode.com/problems/nested-list-weight-sum,Nested List Weight Sum,Medium,,81.7%,"Depth-First Search, Breadth-First Search",30_days
528,https://leetcode.com/problems/random-pick-with-weight,Random Pick with Weight,Medium,,80.5%,"Array, Math, Binary Search, Prefix Sum, Randomized",30_days
129,https://leetcode.com/problems/sum-root-to-leaf-numbers,Sum Root to Leaf Numbers,Medium,,80.5%,"Tree, Depth-First Search, Binary Tree",30_days
543,https://leetcode.com/problems/diameter-of-binary-tree,Diameter of Binary Tree,Easy,,79.2%,"Tree, Depth-First Search, Binary Tree",30_days
347,https://leetcode.com/problems/top-k-frequent-elements,Top K Frequent Elements,Medium,,77.9%,"Array, Hash Table, Divide and Conquer, Sorting, Heap (Priority Queue), Bucket Sort, Counting, Quickselect",30_days
56,https://leetcode.com/problems/merge-intervals,Merge Intervals,Medium,,77.9%,"Array, Sorting",30_days
1,https://leetcode.com/problems/two-sum,Two Sum,Easy,,76.4%,"Array, Hash Table",30_days
121,https://leetcode.com/problems/best-time-to-buy-and-sell-stock,Best Time to Buy and Sell Stock,Easy,,76.4%,"Array, Dynamic Programming",30_days
23,https://leetcode.com/problems/merge-k-sorted-lists,Merge k Sorted Lists,Hard,,76.4%,"Linked List, Divide and Conquer, Heap (Priority Queue), Merge Sort",30_days
20,https://leetcode.com/problems/valid-parentheses,Valid Parentheses,Easy,,74.9%,"String, Stack",30_days
50,https://leetcode.com/problems/powx-n,"Pow(x, n)",Medium,,74.9%,"Math, Recursion",30_days
1762,https://leetcode.com/problems/buildings-with-an-ocean-view,Buildings With an Ocean View,Medium,,74.9%,"Array, Stack, Monotonic Stack",30_days
791,https://leetcode.com/problems/custom-sort-string,Custom Sort String,Medium,,73.2%,"Hash Table, String, Sorting",30_days
973,https://leetcode.com/problems/k-closest-points-to-origin,K Closest Points to Origin,Medium,,71.4%,"Array, Math, Divide and Conquer, Geometry, Sorting, Heap (Priority Queue), Quickselect",30_days
133,https://leetcode.com/problems/clone-graph,Clone Graph,Medium,,71.4%,"Hash Table, Depth-First Search, Breadth-First Search, Graph",30_days
560,https://leetcode.com/problems/subarray-sum-equals-k,Subarray Sum Equals K,Medium,,71.4%,"Array, Hash Table, Prefix Sum",30_days
938,https://leetcode.com/problems/range-sum-of-bst,Range Sum of BST,Easy,,69.5%,"Tree, Depth-First Search, Binary Search Tree, Binary Tree",30_days
1570,https://leetcode.com/problems/dot-product-of-two-sparse-vectors,Dot Product of Two Sparse Vectors,Medium,,69.5%,"Array, Hash Table, Two Pointers, Design",30_days
125,https://leetcode.com/problems/valid-palindrome,Valid Palindrome,Easy,,69.5%,"Two Pointers, String",30_days
31,https://leetcode.com/problems/next-permutation,Next Permutation,Medium,,67.4%,"Array, Two Pointers",30_days
1091,https://leetcode.com/problems/shortest-path-in-binary-matrix,Shortest Path in Binary Matrix,Medium,,67.4%,"Array, Breadth-First Search, Matrix",30_days
138,https://leetcode.com/problems/copy-list-with-random-pointer,Copy List with Random Pointer,Medium,,67.4%,"Hash Table, Linked List",30_days
88,https://leetcode.com/problems/merge-sorted-array,Merge Sorted Array,Easy,,67.4%,"Array, Two Pointers, Sorting",30_days
480,https://leetcode.com/problems/sliding-window-median,Sliding Window Median,Hard,,65.0%,"Array, Hash Table, Sliding Window, Heap (Priority Queue)",30_days
71,https://leetcode.com/problems/simplify-path,Simplify Path,Medium,,65.0%,"String, Stack",30_days
827,https://leetcode.com/problems/making-a-large-island,Making A Large Island,Hard,,65.0%,"Array, Depth-First Search, Breadth-First Search, Union Find, Matrix",30_days
76,https://leetcode.com/problems/minimum-window-substring,Minimum Window Substring,Hard,,62.4%,"Hash Table, String, Sliding Window",30_days
721,https://leetcode.com/problems/accounts-merge,Accounts Merge,Medium,,62.4%,"Array, Hash Table, String, Depth-First Search, Breadth-First Search, Union Find, Sorting",30_days
146,https://leetcode.com/problems/lru-cache,LRU Cache,Medium,,62.4%,"Hash Table, Linked List, Design, Doubly-Linked List",30_days
1004,https://leetcode.com/problems/max-consecutive-ones-iii,Max Consecutive Ones III,Medium,,62.4%,"Array, Binary Search, Sliding Window, Prefix Sum",30_days
1539,https://leetcode.com/problems/kth-missing-positive-number,Kth Missing Positive Number,Easy,,59.4%,"Array, Binary Search",30_days
34,https://leetcode.com/problems/find-first-and-last-position-of-element-in-sorted-array,Find First and Last Position of Element in Sorted Array,Medium,,59.4%,"Array, Binary Search",30_days
14,https://leetcode.com/problems/longest-common-prefix,Longest Common Prefix,Easy,,59.4%,"String, Trie",30_days
977,https://leetcode.com/problems/squares-of-a-sorted-array,Squares of a Sorted Array,Easy,,59.4%,"Array, Two Pointers, Sorting",30_days
19,https://leetcode.com/problems/remove-nth-node-from-end-of-list,Remove Nth Node From End of List,Medium,,56.0%,"Linked List, Two Pointers",30_days
498,https://leetcode.com/problems/diagonal-traverse,Diagonal Traverse,Medium,,56.0%,"Array, Matrix, Simulation",30_days
163,https://leetcode.com/problems/missing-ranges,Missing Ranges,Easy,,56.0%,Array,30_days
346,https://leetcode.com/problems/moving-average-from-data-stream,Moving Average from Data Stream,Easy,,56.0%,"Array, Design, Queue, Data Stream",30_days
636,https://leetcode.com/problems/exclusive-time-of-functions,Exclusive Time of Functions,Medium,,56.0%,"Array, Stack",30_days
415,https://leetcode.com/problems/add-strings,Add Strings,Easy,,51.9%,"Math, String, Simulation",30_days
173,https://leetcode.com/problems/binary-search-tree-iterator,Binary Search Tree Iterator,Medium,,51.9%,"Stack, Tree, Design, Binary Search Tree, Binary Tree, Iterator",30_days
921,https://leetcode.com/problems/minimum-add-to-make-parentheses-valid,Minimum Add to Make Parentheses Valid,Medium,,51.9%,"String, Stack, Greedy",30_days
489,https://leetcode.com/problems/robot-room-cleaner,Robot Room Cleaner,Hard,,51.9%,"Backtracking, Interactive",30_days
2,https://leetcode.com/problems/add-two-numbers,Add Two Numbers,Medium,,47.0%,"Linked List, Math, Recursion",30_days
78,https://leetcode.com/problems/subsets,Subsets,Medium,,47.0%,"Array, Backtracking, Bit Manipulation",30_days
301,https://leetcode.com/problems/remove-invalid-parentheses,Remove Invalid Parentheses,Hard,,47.0%,"String, Backtracking, Breadth-First Search",30_days
647,https://leetcode.com/problems/palindromic-substrings,Palindromic Substrings,Medium,,47.0%,"Two Pointers, String, Dynamic Programming",30_days
65,https://leetcode.com/problems/valid-number,Valid Number,Hard,,47.0%,String,30_days
523,https://leetcode.com/problems/continuous-subarray-sum,Continuous Subarray Sum,Medium,,47.0%,"Array, Hash Table, Math, Prefix Sum",30_days
270,https://leetcode.com/problems/closest-binary-search-tree-value,Closest Binary Search Tree Value,Easy,,47.0%,"Binary Search, Tree, Depth-First Search, Binary Search Tree, Binary Tree",30_days
987,https://leetcode.com/problems/vertical-order-traversal-of-a-binary-tree,Vertical Order Traversal of a Binary Tree,Hard,,47.0%,"Hash Table, Tree, Depth-First Search, Breadth-First Search, Sorting, Binary Tree",30_days
249,https://leetcode.com/problems/group-shifted-strings,Group Shifted Strings,Medium,,47.0%,"Array, Hash Table, String",30_days
207,https://leetcode.com/problems/course-schedule,Course Schedule,Medium,,47.0%,"Depth-First Search, Breadth-First Search, Graph, Topological Sort",30_days
708,https://leetcode.com/problems/insert-into-a-sorted-circular-linked-list,Insert into a Sorted Circular Linked List,Medium,,47.0%,Linked List,30_days
15,https://leetcode.com/problems/3sum,3Sum,Medium,,47.0%,"Array, Two Pointers, Sorting",30_days
863,https://leetcode.com/problems/all-nodes-distance-k-in-binary-tree,All Nodes Distance K in Binary Tree,Medium,,47.0%,"Hash Table, Tree, Depth-First Search, Breadth-First Search, Binary Tree",30_days
8,https://leetcode.com/problems/string-to-integer-atoi,String to Integer (atoi),Medium,,40.7%,String,30_days
219,https://leetcode.com/problems/contains-duplicate-ii,Contains Duplicate II,Easy,,40.7%,"Array, Hash Table, Sliding Window",30_days
3362,https://leetcode.com/problems/zero-array-transformation-iii,Zero Array Transformation III,Medium,,40.7%,"Array, Greedy, Sorting, Heap (Priority Queue), Prefix Sum",30_days
778,https://leetcode.com/problems/swim-in-rising-water,Swim in Rising Water,Hard,,40.7%,"Array, Binary Search, Depth-First Search, Breadth-First Search, Union Find, Heap (Priority Queue), Matrix",30_days
570,https://leetcode.com/problems/managers-with-at-least-5-direct-reports,Managers with at Least 5 Direct Reports,Medium,,40.7%,Database,30_days
670,https://leetcode.com/problems/maximum-swap,Maximum Swap,Medium,,40.7%,"Math, Greedy",30_days
11,https://leetcode.com/problems/container-with-most-water,Container With Most Water,Medium,,40.7%,"Array, Two Pointers, Greedy",30_days
1891,https://leetcode.com/problems/cutting-ribbons,Cutting Ribbons,Medium,,40.7%,"Array, Binary Search",30_days
139,https://leetcode.com/problems/word-break,Word Break,Medium,,40.7%,"Array, Hash Table, String, Dynamic Programming, Trie, Memoization",30_days
124,https://leetcode.com/problems/binary-tree-maximum-path-sum,Binary Tree Maximum Path Sum,Hard,,40.7%,"Dynamic Programming, Tree, Depth-First Search, Binary Tree",30_days
1094,https://leetcode.com/problems/car-pooling,Car Pooling,Medium,,40.7%,"Array, Sorting, Heap (Priority Queue), Simulation, Prefix Sum",30_days
246,https://leetcode.com/problems/strobogrammatic-number,Strobogrammatic Number,Easy,,40.7%,"Hash Table, Two Pointers, String",30_days
1011,https://leetcode.com/problems/capacity-to-ship-packages-within-d-days,Capacity To Ship Packages Within D Days,Medium,,40.7%,"Array, Binary Search",30_days
3,https://leetcode.com/problems/longest-substring-without-repeating-characters,Longest Substring Without Repeating Characters,Medium,,40.7%,"Hash Table, String, Sliding Window",30_days
127,https://leetcode.com/problems/word-ladder,Word Ladder,Hard,,40.7%,"Hash Table, String, Breadth-First Search",30_days
295,https://leetcode.com/problems/find-median-from-data-stream,Find Median from Data Stream,Hard,,40.7%,"Two Pointers, Design, Sorting, Heap (Priority Queue), Data Stream",30_days
1216,https://leetcode.com/problems/valid-palindrome-iii,Valid Palindrome III,Hard,,40.7%,"String, Dynamic Programming",30_days
378,https://leetcode.com/problems/kth-smallest-element-in-a-sorted-matrix,Kth Smallest Element in a Sorted Matrix,Medium,,40.7%,"Array, Binary Search, Sorting, Heap (Priority Queue), Matrix",30_days
2235,https://leetcode.com/problems/add-two-integers,Add Two Integers,Easy,,32.0%,Math,30_days
1778,https://leetcode.com/problems/shortest-path-in-a-hidden-grid,Shortest Path in a Hidden Grid,Medium,,32.0%,"Array, Depth-First Search, Breadth-First Search, Matrix, Interactive",30_days
53,https://leetcode.com/problems/maximum-subarray,Maximum Subarray,Medium,,32.0%,"Array, Divide and Conquer, Dynamic Programming",30_days
986,https://leetcode.com/problems/interval-list-intersections,Interval List Intersections,Medium,,32.0%,"Array, Two Pointers, Line Sweep",30_days
303,https://leetcode.com/problems/range-sum-query-immutable,Range Sum Query - Immutable,Easy,,32.0%,"Array, Design, Prefix Sum",30_days
1838,https://leetcode.com/problems/frequency-of-the-most-frequent-element,Frequency of the Most Frequent Element,Medium,,32.0%,"Array, Binary Search, Greedy, Sliding Window, Sorting, Prefix Sum",30_days
398,https://leetcode.com/problems/random-pick-index,Random Pick Index,Medium,,32.0%,"Hash Table, Math, Reservoir Sampling, Randomized",30_days
230,https://leetcode.com/problems/kth-smallest-element-in-a-bst,Kth Smallest Element in a BST,Medium,,32.0%,"Tree, Depth-First Search, Binary Search Tree, Binary Tree",30_days
394,https://leetcode.com/problems/decode-string,Decode String,Medium,,32.0%,"String, Stack, Recursion",30_days
875,https://leetcode.com/problems/koko-eating-bananas,Koko Eating Bananas,Medium,,32.0%,"Array, Binary Search",30_days
824,https://leetcode.com/problems/goat-latin,Goat Latin,Easy,,32.0%,String,30_days
5,https://leetcode.com/problems/longest-palindromic-substring,Longest Palindromic Substring,Medium,,32.0%,"Two Pointers, String, Dynamic Programming",30_days
68,https://leetcode.com/problems/text-justification,Text Justification,Hard,,32.0%,"Array, String, Simulation",30_days
1209,https://leetcode.com/problems/remove-all-adjacent-duplicates-in-string-ii,Remove All Adjacent Duplicates in String II,Medium,,32.0%,"String, Stack",30_days
123,https://leetcode.com/problems/best-time-to-buy-and-sell-stock-iii,Best Time to Buy and Sell Stock III,Hard,,32.0%,"Array, Dynamic Programming",30_days
4,https://leetcode.com/problems/median-of-two-sorted-arrays,Median of Two Sorted Arrays,Hard,,32.0%,"Array, Binary Search, Divide and Conquer",30_days
1249,https://leetcode.com/problems/minimum-remove-to-make-valid-parentheses,Minimum Remove to Make Valid Parentheses,Medium,,100.0%,"String, Stack",3_months
408,https://leetcode.com/problems/valid-word-abbreviation,Valid Word Abbreviation,Easy,,95.1%,"Two Pointers, String",3_months
680,https://leetcode.com/problems/valid-palindrome-ii,Valid Palindrome II,Easy,,92.2%,"Two Pointers, String, Greedy",3_months
314,https://leetcode.com/problems/binary-tree-vertical-order-traversal,Binary Tree Vertical Order Traversal,Medium,,91.8%,"Hash Table, Tree, Depth-First Search, Breadth-First Search, Sorting, Binary Tree",3_months
215,https://leetcode.com/problems/kth-largest-element-in-an-array,Kth Largest Element in an Array,Medium,,91.3%,"Array, Divide and Conquer, Sorting, Heap (Priority Queue), Quickselect",3_months
543,https://leetcode.com/problems/diameter-of-binary-tree,Diameter of Binary Tree,Easy,,87.1%,"Tree, Depth-First Search, Binary Tree",3_months
1650,https://leetcode.com/problems/lowest-common-ancestor-of-a-binary-tree-iii,Lowest Common Ancestor of a Binary Tree III,Medium,,86.5%,"Hash Table, Two Pointers, Tree, Binary Tree",3_months
227,https://leetcode.com/problems/basic-calculator-ii,Basic Calculator II,Medium,,86.2%,"Math, String, Stack",3_months
199,https://leetcode.com/problems/binary-tree-right-side-view,Binary Tree Right Side View,Medium,,85.3%,"Tree, Depth-First Search, Breadth-First Search, Binary Tree",3_months
1762,https://leetcode.com/problems/buildings-with-an-ocean-view,Buildings With an Ocean View,Medium,,84.3%,"Array, Stack, Monotonic Stack",3_months
236,https://leetcode.com/problems/lowest-common-ancestor-of-a-binary-tree,Lowest Common Ancestor of a Binary Tree,Medium,,84.1%,"Tree, Depth-First Search, Binary Tree",3_months
339,https://leetcode.com/problems/nested-list-weight-sum,Nested List Weight Sum,Medium,,83.5%,"Depth-First Search, Breadth-First Search",3_months
528,https://leetcode.com/problems/random-pick-with-weight,Random Pick with Weight,Medium,,83.0%,"Array, Math, Binary Search, Prefix Sum, Randomized",3_months
560,https://leetcode.com/problems/subarray-sum-equals-k,Subarray Sum Equals K,Medium,,82.7%,"Array, Hash Table, Prefix Sum",3_months
1,https://leetcode.com/problems/two-sum,Two Sum,Easy,,81.3%,"Array, Hash Table",3_months
162,https://leetcode.com/problems/find-peak-element,Find Peak Element,Medium,,81.0%,"Array, Binary Search",3_months
56,https://leetcode.com/problems/merge-intervals,Merge Intervals,Medium,,80.1%,"Array, Sorting",3_months
125,https://leetcode.com/problems/valid-palindrome,Valid Palindrome,Easy,,79.7%,"Two Pointers, String",3_months
1091,https://leetcode.com/problems/shortest-path-in-binary-matrix,Shortest Path in Binary Matrix,Medium,,79.1%,"Array, Breadth-First Search, Matrix",3_months
347,https://leetcode.com/problems/top-k-frequent-elements,Top K Frequent Elements,Medium,,78.7%,"Array, Hash Table, Divide and Conquer, Sorting, Heap (Priority Queue), Bucket Sort, Counting, Quickselect",3_months
138,https://leetcode.com/problems/copy-list-with-random-pointer,Copy List with Random Pointer,Medium,,78.1%,"Hash Table, Linked List",3_months
50,https://leetcode.com/problems/powx-n,"Pow(x, n)",Medium,,77.7%,"Math, Recursion",3_months
129,https://leetcode.com/problems/sum-root-to-leaf-numbers,Sum Root to Leaf Numbers,Medium,,77.0%,"Tree, Depth-First Search, Binary Tree",3_months
71,https://leetcode.com/problems/simplify-path,Simplify Path,Medium,,75.8%,"String, Stack",3_months
88,https://leetcode.com/problems/merge-sorted-array,Merge Sorted Array,Easy,,75.4%,"Array, Two Pointers, Sorting",3_months
31,https://leetcode.com/problems/next-permutation,Next Permutation,Medium,,73.7%,"Array, Two Pointers",3_months
121,https://leetcode.com/problems/best-time-to-buy-and-sell-stock,Best Time to Buy and Sell Stock,Easy,,73.7%,"Array, Dynamic Programming",3_months
827,https://leetcode.com/problems/making-a-large-island,Making A Large Island,Hard,,72.8%,"Array, Depth-First Search, Breadth-First Search, Union Find, Matrix",3_months
23,https://leetcode.com/problems/merge-k-sorted-lists,Merge k Sorted Lists,Hard,,72.8%,"Linked List, Divide and Conquer, Heap (Priority Queue), Merge Sort",3_months
146,https://leetcode.com/problems/lru-cache,LRU Cache,Medium,,72.8%,"Hash Table, Linked List, Design, Doubly-Linked List",3_months
938,https://leetcode.com/problems/range-sum-of-bst,Range Sum of BST,Easy,,71.9%,"Tree, Depth-First Search, Binary Search Tree, Binary Tree",3_months
973,https://leetcode.com/problems/k-closest-points-to-origin,K Closest Points to Origin,Medium,,70.9%,"Array, Math, Divide and Conquer, Geometry, Sorting, Heap (Priority Queue), Quickselect",3_months
1570,https://leetcode.com/problems/dot-product-of-two-sparse-vectors,Dot Product of Two Sparse Vectors,Medium,,70.9%,"Array, Hash Table, Two Pointers, Design",3_months
346,https://leetcode.com/problems/moving-average-from-data-stream,Moving Average from Data Stream,Easy,,69.9%,"Array, Design, Queue, Data Stream",3_months
34,https://leetcode.com/problems/find-first-and-last-position-of-element-in-sorted-array,Find First and Last Position of Element in Sorted Array,Medium,,69.9%,"Array, Binary Search",3_months
921,https://leetcode.com/problems/minimum-add-to-make-parentheses-valid,Minimum Add to Make Parentheses Valid,Medium,,68.8%,"String, Stack, Greedy",3_months
791,https://leetcode.com/problems/custom-sort-string,Custom Sort String,Medium,,68.2%,"Hash Table, String, Sorting",3_months
1004,https://leetcode.com/problems/max-consecutive-ones-iii,Max Consecutive Ones III,Medium,,67.6%,"Array, Binary Search, Sliding Window, Prefix Sum",3_months
133,https://leetcode.com/problems/clone-graph,Clone Graph,Medium,,67.0%,"Hash Table, Depth-First Search, Breadth-First Search, Graph",3_months
986,https://leetcode.com/problems/interval-list-intersections,Interval List Intersections,Medium,,66.3%,"Array, Two Pointers, Line Sweep",3_months
670,https://leetcode.com/problems/maximum-swap,Maximum Swap,Medium,,65.7%,"Math, Greedy",3_months
1539,https://leetcode.com/problems/kth-missing-positive-number,Kth Missing Positive Number,Easy,,65.7%,"Array, Binary Search",3_months
20,https://leetcode.com/problems/valid-parentheses,Valid Parentheses,Easy,,63.6%,"String, Stack",3_months
76,https://leetcode.com/problems/minimum-window-substring,Minimum Window Substring,Hard,,63.6%,"Hash Table, String, Sliding Window",3_months
498,https://leetcode.com/problems/diagonal-traverse,Diagonal Traverse,Medium,,62.0%,"Array, Matrix, Simulation",3_months
65,https://leetcode.com/problems/valid-number,Valid Number,Hard,,61.2%,String,3_months
415,https://leetcode.com/problems/add-strings,Add Strings,Easy,,60.3%,"Math, String, Simulation",3_months
987,https://leetcode.com/problems/vertical-order-traversal-of-a-binary-tree,Vertical Order Traversal of a Binary Tree,Hard,,59.4%,"Hash Table, Tree, Depth-First Search, Breadth-First Search, Sorting, Binary Tree",3_months
708,https://leetcode.com/problems/insert-into-a-sorted-circular-linked-list,Insert into a Sorted Circular Linked List,Medium,,59.4%,Linked List,3_months
636,https://leetcode.com/problems/exclusive-time-of-functions,Exclusive Time of Functions,Medium,,57.5%,"Array, Stack",3_months
270,https://leetcode.com/problems/closest-binary-search-tree-value,Closest Binary Search Tree Value,Easy,,57.5%,"Binary Search, Tree, Depth-First Search, Binary Search Tree, Binary Tree",3_months
2,https://leetcode.com/problems/add-two-numbers,Add Two Numbers,Medium,,56.5%,"Linked List, Math, Recursion",3_months
721,https://leetcode.com/problems/accounts-merge,Accounts Merge,Medium,,55.4%,"Array, Hash Table, String, Depth-First Search, Breadth-First Search, Union Find, Sorting",3_months
207,https://leetcode.com/problems/course-schedule,Course Schedule,Medium,,55.4%,"Depth-First Search, Breadth-First Search, Graph, Topological Sort",3_months
977,https://leetcode.com/problems/squares-of-a-sorted-array,Squares of a Sorted Array,Easy,,55.4%,"Array, Two Pointers, Sorting",3_months
647,https://leetcode.com/problems/palindromic-substrings,Palindromic Substrings,Medium,,54.2%,"Two Pointers, String, Dynamic Programming",3_months
219,https://leetcode.com/problems/contains-duplicate-ii,Contains Duplicate II,Easy,,52.9%,"Array, Hash Table, Sliding Window",3_months
14,https://leetcode.com/problems/longest-common-prefix,Longest Common Prefix,Easy,,52.9%,"String, Trie",3_months
26,https://leetcode.com/problems/remove-duplicates-from-sorted-array,Remove Duplicates from Sorted Array,Easy,,52.9%,"Array, Two Pointers",3_months
173,https://leetcode.com/problems/binary-search-tree-iterator,Binary Search Tree Iterator,Medium,,52.9%,"Stack, Tree, Design, Binary Search Tree, Binary Tree, Iterator",3_months
523,https://leetcode.com/problems/continuous-subarray-sum,Continuous Subarray Sum,Medium,,51.6%,"Array, Hash Table, Math, Prefix Sum",3_months
4,https://leetcode.com/problems/median-of-two-sorted-arrays,Median of Two Sorted Arrays,Hard,,50.2%,"Array, Binary Search, Divide and Conquer",3_months
127,https://leetcode.com/problems/word-ladder,Word Ladder,Hard,,48.7%,"Hash Table, String, Breadth-First Search",3_months
3,https://leetcode.com/problems/longest-substring-without-repeating-characters,Longest Substring Without Repeating Characters,Medium,,47.0%,"Hash Table, String, Sliding Window",3_months
5,https://leetcode.com/problems/longest-palindromic-substring,Longest Palindromic Substring,Medium,,47.0%,"Two Pointers, String, Dynamic Programming",3_months
8,https://leetcode.com/problems/string-to-integer-atoi,String to Integer (atoi),Medium,,47.0%,String,3_months
15,https://leetcode.com/problems/3sum,3Sum,Medium,,47.0%,"Array, Two Pointers, Sorting",3_months
426,https://leetcode.com/problems/convert-binary-search-tree-to-sorted-doubly-linked-list,Convert Binary Search Tree to Sorted Doubly Linked List,Medium,,47.0%,"Linked List, Stack, Tree, Depth-First Search, Binary Search Tree, Binary Tree, Doubly-Linked List",3_months
1216,https://leetcode.com/problems/valid-palindrome-iii,Valid Palindrome III,Hard,,47.0%,"String, Dynamic Programming",3_months
53,https://leetcode.com/problems/maximum-subarray,Maximum Subarray,Medium,,45.2%,"Array, Divide and Conquer, Dynamic Programming",3_months
124,https://leetcode.com/problems/binary-tree-maximum-path-sum,Binary Tree Maximum Path Sum,Hard,,45.2%,"Dynamic Programming, Tree, Depth-First Search, Binary Tree",3_months
282,https://leetcode.com/problems/expression-add-operators,Expression Add Operators,Hard,,45.2%,"Math, String, Backtracking",3_months
824,https://leetcode.com/problems/goat-latin,Goat Latin,Easy,,45.2%,String,3_months
78,https://leetcode.com/problems/subsets,Subsets,Medium,,43.1%,"Array, Backtracking, Bit Manipulation",3_months
200,https://leetcode.com/problems/number-of-islands,Number of Islands,Medium,,43.1%,"Array, Depth-First Search, Breadth-First Search, Union Find, Matrix",3_months
75,https://leetcode.com/problems/sort-colors,Sort Colors,Medium,,40.9%,"Array, Two Pointers, Sorting",3_months
398,https://leetcode.com/problems/random-pick-index,Random Pick Index,Medium,,40.9%,"Hash Table, Math, Reservoir Sampling, Randomized",3_months
1868,https://leetcode.com/problems/product-of-two-run-length-encoded-arrays,Product of Two Run-Length Encoded Arrays,Medium,,40.9%,"Array, Two Pointers",3_months
2667,https://leetcode.com/problems/create-hello-world-function,Create Hello World Function,Easy,,38.3%,,3_months
