ID,URL,Title,Difficulty,Acceptance %,Frequency %,Topics,Timeframe
256,https://leetcode.com/problems/paint-house,Paint House,Medium,,100.0%,"Array, Dynamic Programming",more_than_6m
127,https://leetcode.com/problems/word-ladder,Word Ladder,Hard,,90.1%,"Hash Table, String, Breadth-First Search",more_than_6m
127,https://leetcode.com/problems/word-ladder,Word Ladder,Hard,,100.0%,"Hash Table, String, Breadth-First Search",all
256,https://leetcode.com/problems/paint-house,Paint House,Medium,,100.0%,"Array, Dynamic Programming",all
146,https://leetcode.com/problems/lru-cache,LRU Cache,Medium,,89.6%,"Hash Table, Linked List, Design, Doubly-Linked List",all
