ID,URL,Title,Difficulty,Acceptance %,Frequency %,Topics,Timeframe
215,https://leetcode.com/problems/kth-largest-element-in-an-array,Kth Largest Element in an Array,Medium,,39.7%,"Array, Divide and Conquer, Sorting, Heap (Priority Queue), Quickselect",all
1671,https://leetcode.com/problems/minimum-number-of-removals-to-make-mountain-array,Minimum Number of Removals to Make Mountain Array,Hard,,39.7%,"Array, Binary Search, Dynamic Programming, Greedy",all
1963,https://leetcode.com/problems/minimum-number-of-swaps-to-make-the-string-balanced,Minimum Number of Swaps to Make the String Balanced,Medium,,39.7%,"Two Pointers, String, Stack, Greedy",all
2491,https://leetcode.com/problems/divide-players-into-teams-of-equal-skill,Divide Players Into Teams of Equal Skill,Medium,,39.7%,"Array, Hash Table, Two Pointers, Sorting",all
41,https://leetcode.com/problems/first-missing-positive,First Missing Positive,Hard,,39.7%,"Array, Hash Table",all
1669,https://leetcode.com/problems/merge-in-between-linked-lists,Merge In Between Linked Lists,Medium,,39.7%,Linked List,all
2697,https://leetcode.com/problems/lexicographically-smallest-palindrome,Lexicographically Smallest Palindrome,Easy,,39.7%,"Two Pointers, String, Greedy",all
2625,https://leetcode.com/problems/flatten-deeply-nested-array,Flatten Deeply Nested Array,Medium,,39.7%,,all
55,https://leetcode.com/problems/jump-game,Jump Game,Medium,,39.7%,"Array, Dynamic Programming, Greedy",all
202,https://leetcode.com/problems/happy-number,Happy Number,Easy,,39.7%,"Hash Table, Math, Two Pointers",all
207,https://leetcode.com/problems/course-schedule,Course Schedule,Medium,,39.7%,"Depth-First Search, Breadth-First Search, Graph Theory, Topological Sort",all
240,https://leetcode.com/problems/search-a-2d-matrix-ii,Search a 2D Matrix II,Medium,,39.7%,"Array, Binary Search, Divide and Conquer, Matrix",all
124,https://leetcode.com/problems/binary-tree-maximum-path-sum,Binary Tree Maximum Path Sum,Hard,,39.7%,"Dynamic Programming, Tree, Depth-First Search, Binary Tree",all
283,https://leetcode.com/problems/move-zeroes,Move Zeroes,Easy,,39.7%,"Array, Two Pointers",all
994,https://leetcode.com/problems/rotting-oranges,Rotting Oranges,Medium,,39.7%,"Array, Breadth-First Search, Matrix",all
24,https://leetcode.com/problems/swap-nodes-in-pairs,Swap Nodes in Pairs,Medium,,39.7%,"Linked List, Recursion",all
1268,https://leetcode.com/problems/search-suggestions-system,Search Suggestions System,Medium,,39.7%,"Array, String, Binary Search, Trie, Sorting, Heap (Priority Queue)",all
1839,https://leetcode.com/problems/longest-substring-of-all-vowels-in-order,Longest Substring Of All Vowels in Order,Medium,,39.7%,"String, Sliding Window",all
297,https://leetcode.com/problems/serialize-and-deserialize-binary-tree,Serialize and Deserialize Binary Tree,Hard,,39.7%,"String, Tree, Depth-First Search, Breadth-First Search, Design, Binary Tree",all
70,https://leetcode.com/problems/climbing-stairs,Climbing Stairs,Easy,,39.7%,"Math, Dynamic Programming, Memoization",all
1060,https://leetcode.com/problems/missing-element-in-sorted-array,Missing Element in Sorted Array,Medium,,39.7%,"Array, Binary Search",all
412,https://leetcode.com/problems/fizz-buzz,Fizz Buzz,Easy,,39.7%,"Math, String, Simulation",all
1926,https://leetcode.com/problems/nearest-exit-from-entrance-in-maze,Nearest Exit from Entrance in Maze,Medium,,39.7%,"Array, Breadth-First Search, Matrix",all
1854,https://leetcode.com/problems/maximum-population-year,Maximum Population Year,Easy,,39.7%,"Array, Counting, Prefix Sum",all
1048,https://leetcode.com/problems/longest-string-chain,Longest String Chain,Medium,,39.7%,"Array, Hash Table, Two Pointers, String, Dynamic Programming, Sorting",all
2858,https://leetcode.com/problems/minimum-edge-reversals-so-every-node-is-reachable,Minimum Edge Reversals So Every Node Is Reachable,Hard,,39.7%,"Dynamic Programming, Depth-First Search, Breadth-First Search, Graph Theory",all
57,https://leetcode.com/problems/insert-interval,Insert Interval,Medium,,39.7%,Array,all
123,https://leetcode.com/problems/best-time-to-buy-and-sell-stock-iii,Best Time to Buy and Sell Stock III,Hard,,39.7%,"Array, Dynamic Programming",all
5,https://leetcode.com/problems/longest-palindromic-substring,Longest Palindromic Substring,Medium,,39.7%,"Two Pointers, String, Dynamic Programming",all
387,https://leetcode.com/problems/first-unique-character-in-a-string,First Unique Character in a String,Easy,,39.7%,"Hash Table, String, Queue, Counting",all
39,https://leetcode.com/problems/combination-sum,Combination Sum,Medium,,39.7%,"Array, Backtracking",all
28,https://leetcode.com/problems/find-the-index-of-the-first-occurrence-in-a-string,Find the Index of the First Occurrence in a String,Easy,,39.7%,"Two Pointers, String, String Matching",all
435,https://leetcode.com/problems/non-overlapping-intervals,Non-overlapping Intervals,Medium,,39.7%,"Array, Dynamic Programming, Greedy, Sorting",all
